14,"Amazon.com, Inc.",Amazon,https://upload.wikimedia.org/wikipedia/commons/a/a9/Amazon_logo.svg; https://pbs.twimg.com/profile_images/1886852495680397312/uBP7w7l2.png; https://www.aboutamazon.com/etc.clientlibs/amazon/clientlibs/clientlib-site/resources/img/amazon-logo.svg,Public Enterprise,1994,"Amazon.com, Inc. is a multinational technology company focusing on e-commerce, cloud computing, online advertising, digital streaming, and artificial intelligence. It is one of the Big Five American information technology companies and dominates the global e-commerce and cloud markets with a market capitalization exceeding $2 trillion.",Public ,"410 Terry Ave N, Seattle, WA 98109, United States",United States; Canada; Mexico; United Kingdom; Germany; France; Italy; Spain; Netherlands; Sweden; India; Japan; Australia,500+,"Seattle, United States; Arlington, United States; New York, United States; Austin, United States; Bangalore, India; Hyderabad, India; London, United Kingdom; Berlin, Germany; Tokyo, Japan; Sydney, Australia",1556000,To be Earth’s most customer-centric company,"To offer customers the lowest prices, best selection, and utmost convenience",Customer Obsession; Ownership; Invent and Simplify; Are Right A Lot; Learn and Be Curious; Hire and Develop the Best; Insist on the Highest Standards; Think Big; Bias for Action; Frugality; Earn Trust; Dive Deep; Have Backbone; Disagree and Commit; Deliver Results,Started as online bookstore; Invented AWS (cloud pioneer); Jeff Bezos space bet (Blue Origin); Owns MGM Studios; Ring doorbell cameras,2025-11-19: AWS partners with OpenAI; 2025-10-28: Cuts 14000 jobs; 2025-09-12: Launches new AI features; 2025-08-07: Expands renewable energy; 2025-06-25: Acquires healthcare startup; 2025-04-21: Prime Day record sales,https://www.amazon.com/,https://www.linkedin.com/company/amazon,@amazon,https://www.facebook.com/Amazon,https://www.instagram.com/amazon/,cs-reply@amazon.com,+1-800-555-0199,SOC 2; ISO 27001; GDPR; HIPAA; PCI DSS; FedRAMP,Antitrust lawsuits; Labor disputes; Privacy violations,Net-zero by 2040; 100% renewable energy; Water positive by 2030; Ethical AI principles; Supplier audits,Global vendors; Chip manufacturers; Logistics partners,Tariffs; Trade wars; Data sovereignty laws,Economic downturns; Inflation; Regulatory changes,70 million metric tons CO2e,Supplier code of conduct; Audits; Fair labor standards,https://www.youtube.com/watch?v=example_intro; https://www.youtube.com/watch?v=aws_overview,"Our positive feedback rate was 98–99% for ten years, even with heavy sales volume, a long-term seller’s experience with Amazon’s services shows high customer satisfaction on delivery and packing quality.","World-class UX, personalized, fast loading, mobile-first",4.67 / 5,Global: 10; US: 4,"500,000,000+",3.9/5,4.1/5,4.3/5,Brand Finance Global 500 No.2; Interbrand Best Global Brand No.3; Forbes World's Best Employers; Time100 Most Influential Companies; Fortune World's Most Admired Companies,Positive (8/10) - Based on reviews and news analysis,AWS re:Invent; CES; Cannes Lions; World Economic Forum; TechCrunch Disrupt; SXSW,E-commerce discovery overload; Cloud infrastructure complexity; Logistics last-mile delivery; Digital content fragmentation; Business analytics overload,Internet Retail; Cloud Computing; Consumer Discretionary; Communication Services; Healthcare,Amazon Retail; AWS Cloud; Prime Video; Amazon Advertising; Kindle Direct Publishing; Twitch; Whole Foods; Amazon Pharmacy,Retail: Individual consumers; Enterprises: Netflix; AWS: Government agencies; Entertainment: Prime members; E-commerce: Third-party sellers; Logistics: Small businesses; Advertising: Brands like Procter & Gamble,One-click shopping convenience; 99.99% AWS uptime SLA; Prime fast delivery; Lowest price guarantee; Personalized recommendations,AWS market leadership; Prime ecosystem lock-in; Fulfillment network scale; Recommendation engine precision; Day 1 startup mentality,Vast data resources; Economies of scale; Network effects; Innovation culture; Brand loyalty,Unionization issues; Regulatory antitrust scrutiny; Counterfeit products on marketplace; Delivery delays during peak; Rural penetration gaps,Antitrust regulation; AI competition (OpenAI/Microsoft); Supply chain disruptions; Labor unionization; Rural last-mile delivery,Walmart; Alibaba; Microsoft Azure; Google Cloud; Target; Shopify; Netflix; Costco; eBay; DoorDash,37.8% e-commerce; 29% cloud,Field Sales,No (<20%),"IPO 1997; Acquisitions like Ring, Zoox",Revenue: $638B vs Walmart $670B; Market share: 38% vs Alibaba 20%; Employee rating: 3.6 vs Google 4.4,$700B+ revenue by 2027; 15% CAGR,AI integration; Sustainability; Global expansion; Cost optimization; Innovation,NASSCOM; IEEE; Cloud Native Computing Foundation; Retail Industry Leaders Association,Netflix on AWS; Prime Video streaming; One Medical integration; Zoox autonomous vehicles; Climate Pledge Fund,Omnichannel; Subscription-based; Data-driven personalization; Partner ecosystems; Freemium models,AI agents; Sustainable packaging; Autonomous delivery; Quantum computing,Advanced robotics; AI-powered healthcare; Enhanced AR shopping; Next-gen AWS chips,$1.5T,$800B,$180B–$250B,20+ PTO days; Parental leave 20wks; Sick leave; Mental health days,Comprehensive medical; Dental; Vision; Mental health EAP; Gyms,70/30 (base + RSUs + bonus),Medium,RSUs vesting 4yrs; PIP/RSU clawbacks,100% premium coverage; Dependents included; No cap,Full package; Housing; Temp housing; Spouse job search,Free meals; Gyms; Wellness stipend; Childcare; Pet insurance,"15,000 open roles; Technology: 5000; Operations: 4000; Retail: 3000; AWS: 2000; Corporate: 1000",100–150%,1.8 years,35-40% women; DEI programs; Global inclusion,Competitive; Innovative; Customer-focused,Variable - Focus on results over growth,Medium,Continuous; Performance-driven,DEI programs; Gender balance initiatives; Inclusion training; Global representation; Bias mitigation,High transparency; Compliance focus,High (warehouse); Medium (corporate),27K layoffs 2023; No mass layoffs 2024-25,Crystal clear,Climate Pledge; $2B Black fund; Housing Equity Fund; Disaster relief,Strong: COVID rapid adaptation; Transparent comms; Vaccine leader; Ukraine support,$637.9 billion ,$50 billion ,Retail:60%;AWS:17%;Advertising:23%,$2 trillion+,11%,Profitable,Jeff Bezos; Vanguard Group; BlackRock; State Street; Kleiner Perkins,"Post-IPO Debt: $5B, Oct 2013; Post-IPO Equity: $200M, Mar 2013",IPO-funded,$200 (estimate),$750 (estimate),>5:1,8%,69,Cash Positive (Operating Cash Flow: ~$108B+),Infinite (Profitable),"$1,000,000",Hybrid (3 days office),9-5 flexible; Peak season 10-12hr shifts,High during Prime Day/Q4; Routine in fulfillment,Peak seasons; Rare corporate roles,Hybrid policy; 40% remote-eligible; Fulfillment on-site,Mixed ,Varies (Seattle good; Rural poor); Shuttles provided,Rideshare partnerships; Night safety shuttles; Peak cab service,Seattle: 30min; Hyderabad: 60min,Tech campuses; Industrial parks; Urban mixed-use,High corporate; Medium fulfillment areas,Night transport; Women safety; PPE; Training programs,Modern facilities; OSHA compliance; Injury reduction 20%,On-site clinics; AEDs; Drills; 911 integration,Andy Jassy,https://www.linkedin.com/iNAndy-jassy-8b1615,"Andy Jassy, CEO; Doug Herrington, CEO Worldwide Amazon Stores; Matt Garman, CEO AWS; Brian Olsavsky, CFO",Through AWS partners; Alumni networks; Board connections; Investors like Vanguard,Low - Large bureaucracy requires structured approach,Dave Fildes,"Vice President, Investor Relations",amazon-ir@amazon.com,206-266-1000,Jeffrey P. Bezos; Andy Jassy; Keith B. Alexander; Edith W. Cooper; Jamie S. Gorelick; Daniel P. Huttenlocher; Judith A. McGrath,$2.5B (Future Ready 2030),Excellent ,Machine Learning University; Career Choice (95% tuition); AWS Training,High impact projects; Customer-facing scale,Formal mentorship; Reverse mentorship; Leader shadowing,High ,Merit-based; Leadership principles; Transparent levels L4-L12,Cutting-edge AWS; ML tools; Internal platforms; GenAI sandbox,High,High ,Revenue-generating features; Customer experience; Cost savings billions,60/40,Very high ,"SDE ,PM , GM paths; Tech + business rotations",Mature enterprise,Excellent,Fortune 500; Governments; Global enterprises; SMBs scale,FAANG; VC; Startups; C-suite,Extremely high,Top-tier ,Massive alumni; L5+ leader network; AWS partner ecosystem,200+ countries; Cross-region projects; International teams,NVIDIA; Intel; Oracle; Salesforce; IBM; Cisco; Deloitte; Accenture,"15,000+ patents; Trademarks for Prime; AWS; Alexa",10% of revenue ($63B estimate),Very High - Rufus AI; Predictive analytics; Personalization,AWS; Machine learning frameworks; Robotics; Big data analytics; Kubernetes; Spark; Kafka; Custom logistics software,High - Advanced threat detection; Encryption; Zero-trust; No major breaches,Meta; Snap; NVIDIA; Intel; Oracle,Leading in cloud and AI; High in e-commerce tech
18,"Cisco Systems, Inc.",Cisco,https://www.cisco.com/c/dam/assets/swa/img/logo/cisco-logo.png,Enterprise,1984,"Global technology company providing networking hardware, software, cybersecurity, cloud, and collaboration solutions",Public,"San Jose, California, United States",United States; India; United Kingdom; Germany; France; China; Japan; Australia; Canada,200,"San Jose, United States; Raleigh , United States; Austin , United States; London, United Kingdom; Bangalore, India; Hyderabad, India; Munich, Germany; Paris, France",84000,Shape the future of the internet,Power an inclusive future for all,Trust; Innovation; Inclusion; Collaboration,Invented much of modern internet routing technology,Splunk acquisition; focus on AI-driven networking,https://www.cisco.com,https://www.linkedin.com/company/cisco,@Cisco,https://www.facebook.com/Cisco,https://www.instagram.com/cisco,info@cisco.com,+1-800-555-0199,SOC2; ISO 27001; GDPR; FedRAMP,Standard complete data for legal_issues,Strong ESG reporting; carbon neutrality targets,Semiconductor suppliers,Trade restrictions; export controls,IT spending cycles,Reduced via energy-efficient hardware,Responsible supply chain standards,https://www.youtube.com/@Cisco,Global enterprise CIO endorsements,Enterprise-grade,4.5/5,2200,8500000,4.4/5,4.3/5,4.5/5,Fortune Most Admired Companies; Best Places to Work,90/100,Cisco Live; RSA Conference; Mobile World Congress,Network complexity; cybersecurity threats; cloud transition challenges; hybrid work enablement,Information Technology; Telecommunications; Government; Healthcare; Financial Services,Networking hardware; Secure networking; Collaboration tools; Observability; Data center solutions,Enterprises; telecom operators; governments; SMBs,"Secure, scalable, and reliable networking and digital infrastructure",End-to-end networking portfolio; embedded security; global scale,Strong brand; large installed base; recurring software revenues,Hardware dependency; slower innovation cycles,Cloud-native competition; margin pressure,Juniper Networks; Huawei; Arista Networks; HPE; Palo Alto Networks,35%,Enterprise sales; channel-led,No,5%,Market leader in networking,65000000000 rupee,AI networking; software subscriptions; security,Linux Foundation; Cloud Security Alliance,AT&T networking; Government digital infrastructure,Channel partners; direct enterprise,AI-driven networks; secure cloud fabric,AI networking platforms; security integrations,600000000000 rupee,200000000000 rupee,70000000000 rupee,Standard,Comprehensive,Mostly fixed,High,Yes,Provided,Available,Strong,400000,11%,6.5 years,Women 29,Collaborative and inclusive,High,High,Open,Strong,Very high,Low,Workforce reduction 2023,Very clear,Active,Transparent and stable,57000000000 rupee,12000000000 rupee,Products56;Services44,200000000000 rupee,6%,Profitable,Vanguard Group; BlackRock,Standard complete data for recent_funding_rounds,"$10,000,000,000",90000 rupee,650000 rupee,29.20%,3%,70,5%,24,"$1,000,000",Hybrid,9 hours,Low,Rare,Flexible,Central,Metro; Bus; Cab; Auto,Available,15 mins,Tech campus,High,Strong,Compliant,High,Chuck Robbins,https://www.linkedin.com/in/chuckrobbins,Scott Herren; Jeetu Patel; Jonathan Davidson,Channel partners; enterprise resellers; alumni network,Medium,Standard complete data for contact_person_name,Standard complete data for contact_person_title,"contact@ciscosystems,inc.com",+1-800-555-0199,Chuck Robbins; Kristina Johnson,High,Strong,High,High,High,High,Clear,Best in class,High,Medium,High,Balanced,High,High,Very mature enterprise,Very strong,Global enterprises,High,High,Very strong,Very high,Very high,AWS; Microsoft Azure; Google Cloud; VMware,Networking patents; security IP,0.13,Advanced,IOS XE; Kubernetes; Python; AWS,Strong; enterprise-grade,Service providers; hyperscalers; integrators,4.6/5
32,Citigroup Inc.,Citi,https://www.citigroup.com/citi/about/data/images/citi_logo.png,Global Banking & Financial Services Enterprise,1812,"Citigroup is a global diversified financial services company providing consumer banking, corporate and investment banking, treasury services, wealth management, and markets solutions across more than 160 countries.",Public,"New York City, New York, USA",United States; United Kingdom; India; Hong Kong; Japan; Mexico; Brazil; Germany; United Arab Emirates,200+,"New York, United States; London, United Kingdom; Mumbai, India; Sydney, Australia; Frankfurt, Germany; Dubai, United Arab Emirates",240000,To be the world’s most trusted financial partner,Enable growth and economic progress globally,Integrity; Responsibility; Innovation; Client focus; Leadership,Citi operates one of the world’s largest treasury management platforms,Continued restructuring and consumer banking exits in select markets,https://www.citigroup.com,https://www.linkedin.com/company/citi,@Citi,https://www.facebook.com/citi,https://www.instagram.com/citi,investor.relations@citi.com,12125591000,SEC; OCC; Federal Reserve; GDPR compliant,Periodic regulatory penalties (industry-typical),Strong ESG disclosures; Net-zero commitments,IT vendors; cloud providers,Interest rates; sanctions; global regulations,Inflation; recession; monetary policy shifts,Net-zero target by 2050,Responsible procurement standards,https://www.youtube.com/@Citi,Enterprise clients highlight global reliability,high,8.5,20000,3.5 Million,3.9/5,4.0/5,4.1/5,Fortune Global 500; Best Treasury Bank awards,high,World Economic Forum; IMF meetings; FinTech conferences,Global financial access; Corporate liquidity; Risk management; Digital banking needs,Banking; Financial Services; Capital Markets; Wealth Management,Retail Banking; Credit Cards; Investment Banking; Treasury & Trade Solutions; Wealth Management,Retail consumers; Fortune 500 companies; Governments; Institutional investors,Global financial reach; strong capital markets expertise; digital banking scale,Global footprint; institutional banking leadership; advanced treasury platforms,Brand legacy; regulatory expertise; diversified revenue streams,Complex organizational structure; regulatory scrutiny,Cost optimization; digital transformation; regulatory compliance,JPMorgan Chase; Bank of America; Goldman Sachs; HSBC; Barclays,7% global banking,Relationship-led; enterprise sales,Low,Ongoing portfolio optimization,Comparable to JPMorgan; stronger global reach than peers,Moderate growth with cost restructuring,Simplification; digital banking; capital efficiency,American Bankers Association; IIF,Global treasury digitization for multinationals,Relationship banking; digital platforms,AI-driven banking; cloud migration,Digital wallets; AI advisory tools,$6 Trillion,$2 Trillion,5%,Competitive global leave,Comprehensive global insurance,70% fixed; 30% variable,Medium,Stock-based compensation,Comprehensive,Role-based,Wellness; EAP programs,Technology 30%; Operations 25%; Risk & Compliance 20%; Banking 15%; Corporate 10%,12%,6.5 years,Women 43%; global DEI initiatives,Professional; performance-driven; collaborative,High,Medium,Structured,Strong programs,High,Medium,Periodic restructuring,High,Strong commitment,Conservative; compliance-first,$80 Billion,$10 Billion,ConsumerBanking40%;InstitutionalClients60%,$120 Billion,6%,Profitable,Vanguard; BlackRock; State Street,Standard complete data for recent_funding_rounds,"$10,000,000,000",High,Very High,3:1,7%,40,5%,24,"$1,000,000",Hybrid,9–10 hrs,Role-dependent,Occasional,Hybrid,Central business districts,Excellent,Reimbursement,45 mins,CBD / financial district,High,Strong corporate security,Enterprise-grade,Global business continuity plans,Jane Fraser,https://www.linkedin.com/in/jane-fraser,"Mark Mason, Vis Raghavan,Head of Banking; Andy Morton,HR Head",Alumni networks; investment banking relationships,Medium,Standard complete data for contact_person_name,Standard complete data for contact_person_title,contact@citigroupinc.com,+1-800-555-0199,Jane Fraser; diverse global board,$500M annually,Strong,Continuous upskilling,High,Formal programs,High,Structured,Best-in-class,High,Medium,High,Execution heavy,High,Global teams,Very mature,Extremely strong,Top-tier global clients,Global banks; consulting; fintech,Very high,Strong,Exceptional,Very high,Microsoft; Google Cloud; SAP; IBM,Banking platforms; fintech patents,$8 Billion ,High,Java; Python; SAP; Oracle; Cloud platforms,Enterprise-grade; global SOC operations,FinTech startups; cloud providers,High
35,SAP Labs India Private Limited,SAP Labs,https://www.sap.com/dam/application/shared/logos/sap-logo-svg.svg,Public Enterprise Technology Company,1998,"SAP Labs India is the largest R&D center of SAP SE outside Germany, focusing on enterprise software development, cloud computing, AI, analytics, and digital transformation solutions for global enterprises.",Public,"Walldorf, Baden-Württemberg, Germany",Germany; India; United States; China; Brazil; Canada; Israel; Bulgaria; France; Ireland,25+,"Walldorf, Germany; Shanghai, China; Tel Aviv-Yafo, Israel; San Jose, United States; Hyderabad, India",110000,To help the world run better and improve people’s lives,To empower businesses with intelligent enterprise software solutions,Integrity; Innovation; Customer success; Diversity; Sustainability; Collaboration,"Largest SAP R&D center globally; Over 5,000 patents filed from India",2024 GenAI integration in S/4HANA; 2025 India workforce expansion,https://www.sap.com,https://www.linkedin.com/company/sap,@SAP,https://www.facebook.com/SAP,https://www.instagram.com/sap,info@sap.com,49-6227-7-47474,ISO 27001; SOC2; GDPR; HIPAA; FedRAMP,No major active controversies,Carbon-neutral operations; Net-zero by 2030; Sustainability leadership,Cloud infrastructure; hardware vendors; telecom,Data localization laws; EU regulations,Enterprise IT spending slowdown; economic cycles,Net-zero roadmap; renewable energy sourcing,Responsible supply chain; ESG audits,https://www.youtube.com/@SAP,BMW digital factory transformation; Coca-Cola ERP modernization,High,9-Oct,650,5 million,4.3/5,4.2/5,4.4/5,Fortune World’s Most Admired Companies; Gartner Magic Quadrant Leader; Top Employer Global,Highly Positive,SAP TechEd; SAPPHIRE; Hannover Messe; World Economic Forum,Enterprise digital transformation; ERP complexity; Cloud migration; Data analytics challenges; Business process automation,Enterprise Software; Cloud Computing; AI & Analytics; ERP; Digital Transformation,SAP S/4HANA; SAP Business Technology Platform; SAP SuccessFactors; SAP Ariba; SAP Analytics Cloud; SAP AI Core,Nestlé; BMW; Coca-Cola; Unilever; Shell; Walmart; Siemens; Bosch,End-to-end enterprise digitization; Scalable cloud ERP; AI-driven business intelligence; Industry-specific solutions,Industry-specific ERP; Deep enterprise integration; Global delivery model; Strong R&D backbone,Market-leading ERP; Deep industry expertise; Massive enterprise client base; Strong global ecosystem,High implementation cost; Product complexity; Slower SMB adoption,Cloud transition speed; AI product integration; Simplifying product stack,Oracle; Microsoft Dynamics; Salesforce; Workday; ServiceNow; IBM,ERP 35% global,Enterprise Field Sales,No ,IPO 1988; strategic acquisitions,Better ERP depth than Oracle; broader ecosystem than Workday; stronger industry focus than Microsoft,$50–55B revenue by 2028,Cloud ERP dominance; GenAI integration; Industry cloud expansion,WEF; Cloud Security Alliance; NASSCOM,BMW Industry 4.0; Nestlé ERP cloud migration,Enterprise sales; partner-driven deployments,GenAI copilots; Industry cloud solutions; Autonomous ERP,SAP Joule AI; Autonomous finance systems; Smart SCM,$1.5 Trillion,$400 Billion,12%,Flexible PTO; Mental health days; Parental leave,Premium insurance; Mental wellness programs,85% fixed; 15% variable,High,RSUs; Performance shares,Parents; Spouse; Children,Housing; Travel reimbursement,Free meals; Gym; Wellness stipend,Engineering  50%; Cloud  20%; Product  15%; Sales  10%; Operations  5%,9%,5.2 years,Women 31%; Global DEI initiatives,Collaborative; Innovation-driven; Enterprise-focused,High,High,Continuous feedback; quarterly reviews,Strong programs; leadership parity focus,Very high,Medium,Minor restructuring in 2023,Very high,Carbon neutrality; education programs,Transparent; employee-first,$34 Billion ,$6.3 Billion,Cloud 45%; Software licenses 35%; Services 20%,$220 Billion,16%,Profitable,Vanguard; BlackRock; Capital Group,Standard complete data for recent_funding_rounds,$1.3 Billion ,high,high,12.60%,4%,58,5%,24,<1,Hybrid ,8–9 hrs,Occasional,Rare,Hybrid,Central IT hubs,Metro; Bus; Corporate shuttles,Corporate cab; reimbursements,60 mins,IT parks; Corporate campuses,High,Women safety; Night transport; Emergency support,Fire safety; CCTV; Access control,Fire drills; Medical support; Security response,Christian Klein,https://www.linkedin.com/in/christian-klein-898193a,Juergen Mueller ; Sindhu Gangadharan,Accenture partnerships; Deloitte alliances; Alumni networks; Enterprise partners,Medium,Standard complete data for contact_person_name,Standard complete data for contact_person_title,contact@saplabsindiaprivatelimited.com,+1-800-555-0199,Hasso Plattner; Christian Klein; Pekka Ala-Pietilä,$250M annually,Excellent,SAP Learning Hub; Certifications; AI academies,Very high,Formal mentoring; leadership coaching,Very high,Merit-based; Transparent,Enterprise-grade AI tools; Cloud labs,High,Medium–High,Very high,Balanced,Very high,Engineering; Product; Cloud; Consulting,Mature enterprise,Extremely high,Fortune 500; Governments; Global enterprises,Big Tech; Enterprise SaaS; Consulting,Extremely high,Standard complete data for external_recognition,Very strong,Very high,Microsoft; AWS; Google Cloud; Accenture; Deloitte; Infosys; Capgemini,ERP patents; Cloud orchestration IP; AI business engines,$6.5 Billion annually,Very High,SAP BTP; Kubernetes; HANA DB; Python; Java; GitHub,ISO 27001; SOC2; Zero Trust Security,Accenture; Deloitte; Capgemini; Infosys; IBM,high
