company_id,name,short_name,logo_url,category,incorporation_year,overview_text,nature_of_company,headquarters_address,operating_countries,office_count,office_locations,employee_size,vision_statement,mission_statement,core_values,history_timeline,recent_news,website_url,linkedin_url,twitter_handle,facebook_url,instagram_url,primary_contact_email,primary_phone_number,regulatory_status,legal_issues,esg_ratings,supply_chain_dependencies,geopolitical_risks,macro_risks,carbon_footprint,ethical_sourcing,marketing_video_url,customer_testimonials,website_quality,website_rating,website_traffic_rank,social_media_followers,glassdoor_rating,indeed_rating,google_rating,awards_recognitions,brand_sentiment_score,event_participation,pain_points_addressed,focus_sectors,offerings_description,top_customers,core_value_proposition,unique_differentiators,competitive_advantages,weaknesses_gaps,key_challenges_needs,key_competitors,market_share_percentage,sales_motion,customer_concentration_risk,exit_strategy_history,benchmark_vs_peers,future_projections,strategic_priorities,industry_associations,case_studies,go_to_market_strategy,innovation_roadmap,product_pipeline,tam,sam,som,leave_policy,health_support,fixed_vs_variable_pay,bonus_predictability,esops_incentives,family_health_insurance,relocation_support,lifestyle_benefits,hiring_velocity,employee_turnover,avg_retention_tenure,diversity_metrics,work_culture_summary,manager_quality,psychological_safety,feedback_culture,diversity_inclusion_score,ethical_standards,burnout_risk,layoff_history,mission_clarity,sustainability_csr,crisis_behavior,annual_revenue,annual_profit,revenue_mix,valuation,yoy_growth_rate,profitability_status,key_investors,recent_funding_rounds,total_capital_raised,customer_acquisition_cost,customer_lifetime_value,cac_ltv_ratio,churn_rate,net_promoter_score,burn_rate,runway_months,burn_multiplier,remote_policy_details,typical_hours,overtime_expectations,weekend_work,flexibility_level,location_centrality,public_transport_access,cab_policy,airport_commute_time,office_zone_type,area_safety,safety_policies,infrastructure_safety,emergency_preparedness,ceo_name,ceo_linkedin_url,key_leaders,warm_intro_pathways,decision_maker_access,contact_person_name,contact_person_title,contact_person_email,contact_person_phone,board_members,training_spend,onboarding_quality,learning_culture,exposure_quality,mentorship_availability,internal_mobility,promotion_clarity,tools_access,role_clarity,early_ownership,work_impact,execution_thinking_balance,automation_level,cross_functional_exposure,company_maturity,brand_value,client_quality,exit_opportunities,skill_relevance,external_recognition,network_strength,global_exposure,technology_partners,intellectual_property,r_and_d_investment,ai_ml_adoption_level,tech_stack,cybersecurity_posture,partnership_ecosystem,tech_adoption_rating
1,Accenture plc,Accenture,https://www.accenture.com/_acnmedia/Accenture/Dev/RedesigNAcc_Logo_Black.svg,Enterprise,1989,"Accenture is a global professional services company providing strategy, consulting, digital, technology, and operations services, serving large enterprises and governments across more than 120 countries with a strong focus on cloud, AI, and digital transformation.",Public,"Dublin, Ireland",United States; United Kingdom; India; Germany; France; Japan; Australia; Canada; Brazil; Singapore,200+,"New York, United States; London, United Kingdom; Bangalore, India; Paris, France; Tokyo, Japan; Toronto, Canada; Sydney, Australia; Frankfurt, Germany","740,000 employees",To drive continuous innovation and help the world’s leading organizations build their digital core and achieve greater value.,"Deliver on the promise of technology and human ingenuity to create value and shared success for clients, people, shareholders, partners, and communities.",Client value creation; Integrity; Respect for individuals; Innovation; Stewardship; Best people,One of the largest employers of tech talent globally; Invests over $1B annually in R&D and innovation,"2024,Invested $3B in generative AI strategy; 2024,Acquired multiple cloud and AI consulting firms in Europe",https://www.accenture.com,https://www.linkedin.com/company/accenture,@Accenture,https://www.facebook.com/accenture,https://www.instagram.com/accenture,contact@accenture.com,+1-800-555-0199,ISO 27001; SOC 2; GDPR Compliance; HIPAA Compliance,Periodic labor and contract disputes; no major unresolved global litigation,Net-zero commitment by 2025; Science Based Targets; Diversity equity programs,Cloud providers; Software vendors; Talent workforce,Trade regulations; Data privacy laws; Regional conflicts,Global recession; Enterprise IT budget cuts,Actively reducing via renewable energy sourcing,Supplier code of conduct; ESG audits,https://www.youtube.com/@Accenture,Unilever transformation story; Microsoft cloud case,"Enterprise-grade, high clarity, strong thought leadership, polished UX",8.5,"Global 12,000; US 4,000 ",15000000,4.1/5,4.2/5,4.3/5,Fortune Global 500; Great Place to Work Certified; Gartner Magic Quadrant Leader; Forbes Most Admired Companies,"Very Positive,strong global brand, high enterprise trust",World Economic Forum; Microsoft Ignite; AWS re:Invent; Global Fintech Fest,Digital transformation complexity; Legacy IT modernization; Cloud migration risk; Talent and skill gaps; Cybersecurity threats; Operational inefficiency,Financials; Health Care; Consumer Discretionary; Industrials; Energy; Telecommunications; Public Sector; Technology,Management Consulting; Technology Services; Cloud Solutions; AI & Analytics; Cybersecurity; Business Process Outsourcing; Digital Engineering,Fortune 500 Enterprises; Global Banks; Government Agencies; Healthcare Systems; Telecom Operators; Energy Majors,End-to-end transformation; Global delivery scale; Deep industry expertise; Strong technology partnerships; Innovation leadership,Global delivery network; Industry-specific consulting; Strong alliance ecosystem; Proprietary AI and analytics platforms,Brand leadership; Scale and geographic reach; Deep enterprise relationships; Strong partner network,High cost structure; Dependency on large enterprise spending cycles; Complex organizational structure,Talent retention; Pricing pressure from competitors; Rapid AI disruption; Regulatory compliance across regions,IBM Consulting; Deloitte; TCS; Infosys; Capgemini; Cognizant; Wipro; PwC; EY,6–7% of global IT services market,Enterprise Field Sales,"No,highly diversified client base",Mature public enterprise; Strategic acquisitions,Higher revenue than Capgemini; Comparable margins to IBM Consulting; Stronger cloud alliances than TCS,Revenue projected $70B by 2027,Generative AI leadership; Cloud transformation; Sustainability consulting; Emerging markets growth,World Economic Forum; NASSCOM; Business Roundtable,Microsoft cloud modernization; Unilever digital supply chain,Enterprise account teams; Strategic alliances; Thought leadership marketing,GenAI platforms; Industry cloud solutions; Cyber resilience tools,AI copilots; Industry SaaS accelerators,$1.5T global IT and business services,$400B enterprise digital transformation,7%,Paid leave; Mental health days,Health insurance; Mental wellness,Mostly fixed,Moderate,Stock grants; Performance shares,Dependents covered; OPD,Housing; Travel reimbursement,Wellness programs; Meals; Fitness,"Technology ~15,000 open roles; Consulting ~8,000 open roles; Operations ~6,000 open roles; Sales ~2,000 open roles",15% annually (industry benchmark estimate),4.5 years,47% women workforce; Global DEI programs,Collaborative; Performance-driven,Strong coaching focus,High,Continuous feedback; Annual reviews,Gender equity; Inclusive leadership,High integrity; Compliance-driven,Moderate,Periodic restructuring,High,Net-zero goals; Community programs,Transparent and compliance-driven,$64.1B (FY2024),$7.2B net income (FY2024),Consulting 55%;ManagedServices 45%,$220B market capitalization ,3%,Profitable,Vanguard Group; BlackRock; State Street,"Public equity markets,ongoing institutional investment",Public market funded,$100K+ per enterprise ,$5M+,3:1,<3%,60,"Not Applicable,cash-flow positive",Not Applicable,<1.0,"Hybrid, 60% flexible",Flexible,Occasional during project peaks,Rare,Remote; Hybrid,Central business districts,Metro; Bus; Train,Ride-hailing; Company transport,45 minutes,IT hub,Secure; Well-monitored,Late-night transport; Workplace safety,Fire compliant; Secure access,Medical support; Fire drills,Julie Sweet,https://www.linkedin.com/in/juliesweet,"Julie Sweet,Chair & CEO;Manish Sharma,CEO; Jack Azagury,Group Chief Executive",Fortune 500 board connections; Alumni network; Technology partner ecosystems,"Low,Large enterprise structure with formal procurement and partner-led access",Julie Sweet,CEO,prabhakar.d.phatak@accenture.com,793 1578,Julie Sweet; David Rowland; Former global executives,"$1,500 per employee/year",Industry-leading,Internal LMS; Certifications,High,Leadership mentors; Peer mentors,High,Merit-based; Transparent,Enterprise software; Cloud platforms,High,Medium,Client-facing; Revenue-linked,Balanced,High,Consulting; Technology; Sales,Mature enterprise,Global top-tier brand,Fortune 500; Governments,Big Tech; Global consultancies; Industry leadership roles,Very High,Strong global credibility,Global alumni network; Executive connections,Global clients; International teams,Microsoft; SAP; Oracle; AWS; Google Cloud; Salesforce; NVIDIA,Accenture Labs IP; Industry AI frameworks; Proprietary cloud accelerators,$1.5B annually,"High,generative AI platforms, AI-led consulting, automation for delivery optimization",SAP; Salesforce; AWS; Microsoft Azure; ServiceNow; Kubernetes; Python,ISO 27001; SOC 2; Global cyber defense centers,Microsoft; SAP; Oracle; Google; AWS; Salesforce,"High,Industry Leader; Top-tier among peers"
4,Google LLC (Subsidiary of Alphabet Inc.),Google,https://www.google.com/images/branding/googlelogo/2x/googlelogo_color_272x92dp.png,Enterprise,1998,"Google is a global technology leader specializing in internet services, digital advertising, cloud computing, artificial intelligence, and consumer hardware, holding dominant market positions in search, mobile operating systems, and online video platforms.",Subsidiary (Public Parent: Alphabet Inc.),"1600 Amphitheatre Parkway, Mountain View, California, USA",United States; United Kingdom; India; Germany; Ireland; Hong Kong; Japan; Canada; Australia; Brazil,100+,"New York, United States; London, United Kingdom; Bangalore, India; Dublin, Ireland; Tokyo, Japan; Toronto, Canada; Sydney, Australia",182000,To provide access to the world's information in one click.,To organize the world's information and make it universally accessible and useful.,Focus on the user; Innovation; Integrity; Diversity; Sustainability,Alphabet's market cap exceeds $1.8T; Google processes over 8.5 billion searches per day,"2024,Launched Gemini AI platform globally; 2023,Expanded Google Cloud regions in India and Europe",https://www.google.com,https://www.linkedin.com/company/google,@Google,https://www.facebook.com/Google,https://www.instagram.com/google,contact@googlellc(subsidiaryofalphabetinc.com,+1-800-555-0199,ISO 27001; SOC 2; GDPR Compliance; CCPA Compliance,Ongoing global antitrust and data privacy investigations,Carbon neutral operations; Renewable energy sourcing; Circular economy initiatives,Semiconductor vendors; Data center hardware suppliers; Network providers,Data sovereignty laws; Trade restrictions; Content regulations,Global ad spend slowdown; Economic cycles; Regulatory costs,Net-zero operations target by 2030,Supplier Code of Conduct; ESG audits,https://www.youtube.com/@Google,Global enterprise cloud adoption stories; Major advertiser success cases,"Extremely high usability, global accessibility, strong product segmentation and developer resources",8.5,Global Rank 1; US Rank 1,200000000,4.4/5,4.3/5,4.5/5,Fortune Most Admired Companies; Best Global Brand Interbrand; Great Place to Work,"Very Positive,strong global trust and innovation leadership",Google I/O; CES; Mobile World Congress,Information discovery; Digital advertising efficiency; Cloud infrastructure scalability; Data security; AI automation; Collaboration productivity,Technology; Communication Services; Financials; Consumer Discretionary; Health Care; Education; Public Sector,Google Search; YouTube; Google Cloud Platform; Workspace; Android OS; Pixel Devices; Google Ads; AI Models,Global Advertisers; SMEs; Fortune 500 Enterprises; Governments; Education Institutions; App Developers,Market-leading AI and data infrastructure; Global reach and scale; Integrated digital ecosystem; High-performance cloud services,Global search dominance; AI research leadership; Massive data scale; Android ecosystem control,Network effects; Brand trust; Proprietary AI models; Advertising platform scale,Regulatory scrutiny; Advertising revenue dependency; Cloud market share behind AWS/Azure,Antitrust regulation; Data privacy laws; AI ethics governance; Cloud profitability,Microsoft; Amazon; Meta; Apple; IBM; Oracle; Salesforce; Alibaba Cloud,90% global search market,Product-Led Growth,"No,highly diversified advertiser base",Strategic acquisitions and spin-offs,Higher AI maturity than Meta; Comparable cloud to Azure; Larger ad reach than Amazon,Revenue projected $380B by 2027,AI platform expansion; Cloud profitability; Hardware ecosystem growth; Sustainability leadership,WEF; Cloud Native Computing Foundation; Internet Society,Spotify on Google Cloud; US education digital transformation,Freemium products; Enterprise sales teams; Global partner network,Generative AI platforms; Quantum computing; Sustainable data centers,Gemini AI upgrades; Pixel hardware; Advanced cloud AI tools,$2T global digital advertising and cloud market,$600B,25%,Paid leave; Wellness days; Parental leave,Health insurance; Mental wellness; OPD,Mostly fixed,High,Stock grants; Performance bonuses,Dependents covered; Global health plans,Housing; Visa support; Travel reimbursement,Meals; Fitness; Wellness programs,"Engineering ~3,000 roles; Cloud ~1,200 roles; Sales ~800 roles; AI Research ~600 roles",12% annually ,5 years,34% women globally; Global DEI programs,Collaborative; Innovation-driven,High,High,Continuous feedback; Performance reviews,Global DEI initiatives; Inclusive hiring,Strong compliance; Transparency focus,Moderate,Periodic global restructuring,Very High,Renewable energy; Education initiatives,Transparent and compliance-driven,$307B (Alphabet FY2023),$74B (Alphabet FY2023 Net Income),Advertising 77%;Cloud 11%;Hardware&Services 12%,$1.8T market capitalization,9%,Profitable,Vanguard Group; BlackRock; Fidelity,IPO 2004; Ongoing public market funding,$25B (IPO and subsequent equity raises),"Low,organic and platform-driven","Very High,multi-year enterprise and advertiser relationships",>50:1,<5%,70,"Not Applicable,cash-flow positive",24,<1.0,Hybrid-first,Flexible,Occasional,Rare,Remote; Hybrid,Central business districts,Metro; Bus; Rail,Ride-hailing; Company transport,30 minutes,Tech hub,Secure; Well-lit,Workplace safety; Emergency transport,Fire compliant; Secure access,Medical teams; Fire drills,Sundar Pichai,https://www.linkedin.com/in/sundarpichai,"Sundar Pichai,CEO; Thomas Kurian,CEO Google Cloud; Ruth Porat,President & CFO Alphabet",Global alumni network; Venture capital ecosystem; Enterprise partner programs,"Low,Large enterprise with structured partner and procurement channels",Standard complete data for contact_person_name,CEO,sundar@google.com,(650) 253-0000,Sundar Pichai; John L. Hennessy; Roger W. Ferguson Jr.; Frances Arnold,"$2,000 per employee/year",Excellent,Internal LMS; AI certifications; Tech bootcamps,High,Leadership mentoring; Peer networks,High,Merit-based; Transparent,Cloud platforms; AI tools; DevOps suites,High,High,Global products; Revenue-driving,Balanced,Very High,Engineering; Sales; Research,Mature enterprise,Top-tier global brand,Fortune 500; Governments; Global enterprises,Big Tech; Startups; Global consultancies,Very High,Elite employer brand,Global alumni network; VC ecosystem,International teams; Global clients,NVIDIA; Intel; SAP; VMware; Accenture; TCS,Search algorithms; AI models; Android OS; Cloud patents,$45B annually,"Very High,Gemini AI, DeepMind research, enterprise AI cloud services",TensorFlow; Kubernetes; Python; Java; Google Cloud Infrastructure,ISO 27001; SOC 2; Zero Trust architecture,Samsung; NVIDIA; SAP; Accenture; Salesforce,Enterprise Leader; AI Pioneer
5,Apple Inc.,Apple,https://www.apple.com/ac/structured-data/images/knowledge_graph_logo.png,Enterprise,1976,"Apple is a global technology company designing and selling consumer electronics, operating systems, software platforms, and digital services, with market leadership in premium smartphones, personal computing devices, and an integrated ecosystem of hardware, software, and services.",Public,"One Apple Park Way, Cupertino, California, USA",United States; United Kingdom; China; India; Japan; Germany; France; Australia; Canada; Hong Kong,100+,"Cupertino, United States; Austin, United States; London, United Kingdom; Shanghai, China; Bangalore, India; Tokyo, Japan; Munich, Germany",161000,To make the best products on earth and leave the world better than we found it.,"To bring the best user experience to customers through innovative hardware, software, and services.",Innovation; Privacy; Quality; Sustainability; Inclusion; Customer focus,First $3T market cap company; Designs its own M-series and A-series chips,"2024,Launched Vision Pro spatial computing headset; 2023,Introduced M3 chip series for Macs",https://www.apple.com,https://www.linkedin.com/company/apple,@Apple,https://www.facebook.com/apple,https://www.instagram.com/apple,contact@apple.com,+1-800-555-0199,GDPR Compliance; SOC 2; ISO 27001; CCPA Compliance,App Store antitrust and regulatory cases in US and EU,Carbon neutral corporate operations; Renewable energy sourcing; Supplier Clean Energy Program,TSMC semiconductor fabrication; Foxconn manufacturing; Global logistics providers,US-China trade tensions; Data privacy regulations; Export controls,Consumer spending cycles; Currency fluctuations; Global supply disruptions,Carbon neutral corporate operations with 2030 net-zero supply chain goal,Supplier Code of Conduct; Responsible Minerals Program,https://www.youtube.com/@Apple,Global enterprise IT adoption stories; Creative industry endorsements,"Extremely high-quality UX with strong product storytelling, localization, accessibility, and e-commerce integration",8.5,Global Rank Top 10; US Rank Top 10,300000000,4.2/5,4.3/5,4.6/5,Fortune Most Admired Companies; Interbrand Best Global Brand; TIME Most Influential Companies,"Very Positive,premium brand perception and strong customer loyalty",Apple WWDC; CES; Global Developer Conferences,Secure personal computing; Mobile productivity; Digital entertainment access; Device ecosystem integration; Data privacy protection,Technology Hardware; Consumer Electronics; Media & Entertainment; Software Services; Financial Services,iPhone; Mac; iPad; Apple Watch; AirPods; iOS; macOS; App Store; Apple Music; iCloud; Apple TV+,Global Consumers; Enterprise IT Departments; Education Institutions; App Developers; Media Companies,Seamless ecosystem integration; Premium design and quality; Strong privacy and security; High-performance proprietary silicon,Proprietary silicon design; Closed-loop ecosystem; Premium brand positioning; Retail experience network,Brand loyalty; Vertical integration; Global retail presence; Software-hardware optimization,Premium pricing limits mass-market reach; Heavy reliance on iPhone revenue; Closed ecosystem restrictions,Regulatory scrutiny on App Store; Supply chain concentration in Asia; Services growth saturation,Samsung; Microsoft; Google; Huawei; Dell; HP; Sony; Meta,20% global smartphone shipments,Product-Led Growth,"No,highly diversified global consumer base",Strategic acquisitions and product ecosystem expansion,Higher margins than Samsung; Stronger ecosystem lock-in than Google; Comparable R&D to Microsoft,Revenue projected $420B by 2027,Services expansion; AR/VR ecosystem growth; Silicon innovation; Sustainability leadership,Consumer Technology Association; Business Roundtable; World Economic Forum,Enterprise Mac deployment at IBM; Education digital learning programs,Premium retail stores; Online direct sales; Enterprise partnerships,Generative AI integration; Spatial computing; Next-gen silicon,iPhone AI features; Vision ecosystem expansion; New Mac chipsets,$3T global consumer electronics and digital services market,$1T,25%,Paid leave; Parental leave; Wellness days,Health insurance; Mental wellness; OPD,Mostly fixed,High,RSUs; Performance bonuses,Dependents covered; Global health plans,Housing; Visa support; Travel reimbursement,Meals; Fitness; Wellness programs,"Engineering ~2,500 roles; Retail ~1,800 roles; Operations ~900 roles; AI/ML ~600 roles",10% annually ,6 years,35% women globally; Global DEI hiring programs,Innovation-driven; Collaborative,High,Moderate to High,Performance reviews; Continuous feedback,Inclusive hiring; Global DEI programs,Strong compliance; Transparency,Moderate,Limited restructuring; selective workforce adjustments,Very High,Renewable energy; Education initiatives; Supplier responsibility,Transparent and compliance-driven,$383B (FY2023),$97B (FY2023 Net Income),iPhone 52%;Services 22%;Mac 8%;iPad 7%;Wearables&Accessories 11%,$3T market capitalization,2%,Profitable,Vanguard Group; BlackRock; Berkshire Hathaway,IPO 1980; Ongoing public equity markets,$100M (IPO historical; equity markets thereafter),"Low,brand-driven and retail ecosystem","Very High,multi-device and service subscriptions",>30:1,<10%,70,"Not Applicable,cash-flow positive",24,<1.0,Hybrid,Flexible,Occasional,Rare,Hybrid; On-site,Central business districts,Metro; Bus; Rail,Ride-hailing; Company transport,25 minutes,Tech hub,Secure; Well-lit,Workplace safety; Emergency transport,Fire compliant; Secure access,Medical teams; Fire drills,Tim Cook,https://www.linkedin.com/in/timothy-cook,"Tim Cook,CEO; Luca Maestri,CFO; John Ternus,SVP Hardware Engineering",Global alumni network; Venture capital ecosystem; Enterprise channel partners,"Low,centralized corporate procurement and structured enterprise sales channels",Tim Cook,CEO,tcook@apple.com.,(408) 996-1010,Tim Cook; Arthur D. Levinson; Al Gore; Monica Lozano,"$1,500 per employee/year",Excellent,Internal LMS; Leadership programs; Tech certifications,High,Senior leader mentoring; Peer programs,High,Merit-based; Transparent,Proprietary dev tools; Cloud platforms; AI tools,High,High,Global products; Revenue-driving,Balanced,High,Engineering; Design; Marketing,Mature enterprise,Top-tier global brand,Global consumers; Fortune 500 enterprises,Big Tech; Startups; Global enterprises,Very High,Elite employer brand,Global alumni network; Executive leadership,International teams; Global markets,TSMC; Foxconn; Broadcom; Qualcomm; SAP,M-series chips; iOS and macOS; Face ID; Retina display technology,$30B annually,"High,on-device AI, Siri, Vision Pro spatial computing, generative AI integration",Swift; Xcode; iCloud infrastructure; SAP ERP; Proprietary silicon,ISO 27001; SOC 2; Secure Enclave architecture,TSMC; IBM; SAP; Nike; Goldman Sachs,Enterprise Leader; Innovation Pioneer
