company_id,name,short_name,logo_url,category,incorporation_year,overview_text,nature_of_company,headquarters_address,operating_countries,office_count,office_locations,employee_size,vision_statement,mission_statement,core_values,history_timeline,recent_news,website_url,linkedin_url,twitter_handle,facebook_url,instagram_url,primary_contact_email,primary_phone_number,regulatory_status,legal_issues,esg_ratings,supply_chain_dependencies,geopolitical_risks,macro_risks,carbon_footprint,ethical_sourcing,marketing_video_url,customer_testimonials,website_quality,website_rating,website_traffic_rank,social_media_followers,glassdoor_rating,indeed_rating,google_rating,awards_recognitions,brand_sentiment_score,event_participation,pain_points_addressed,focus_sectors,offerings_description,top_customers,core_value_proposition,unique_differentiators,competitive_advantages,weaknesses_gaps,key_challenges_needs,key_competitors,market_share_percentage,sales_motion,customer_concentration_risk,exit_strategy_history,benchmark_vs_peers,future_projections,strategic_priorities,industry_associations,case_studies,go_to_market_strategy,innovation_roadmap,product_pipeline,tam,sam,som,leave_policy,health_support,fixed_vs_variable_pay,bonus_predictability,esops_incentives,family_health_insurance,relocation_support,lifestyle_benefits,hiring_velocity,employee_turnover,avg_retention_tenure,diversity_metrics,work_culture_summary,manager_quality,psychological_safety,feedback_culture,diversity_inclusion_score,ethical_standards,burnout_risk,layoff_history,mission_clarity,sustainability_csr,crisis_behavior,annual_revenue,annual_profit,revenue_mix,valuation,yoy_growth_rate,profitability_status,key_investors,recent_funding_rounds,total_capital_raised,customer_acquisition_cost,customer_lifetime_value,cac_ltv_ratio,churn_rate,net_promoter_score,burn_rate,runway_months,burn_multiplier,remote_policy_details,typical_hours,overtime_expectations,weekend_work,flexibility_level,location_centrality,public_transport_access,cab_policy,airport_commute_time,office_zone_type,area_safety,safety_policies,infrastructure_safety,emergency_preparedness,ceo_name,ceo_linkedin_url,key_leaders,warm_intro_pathways,decision_maker_access,contact_person_name,contact_person_title,contact_person_email,contact_person_phone,board_members,training_spend,onboarding_quality,learning_culture,exposure_quality,mentorship_availability,internal_mobility,promotion_clarity,tools_access,role_clarity,early_ownership,work_impact,execution_thinking_balance,automation_level,cross_functional_exposure,company_maturity,brand_value,client_quality,exit_opportunities,skill_relevance,external_recognition,network_strength,global_exposure,technology_partners,intellectual_property,r_and_d_investment,ai_ml_adoption_level,tech_stack,cybersecurity_posture,partnership_ecosystem,tech_adoption_rating
5,Apple Inc.,Apple,https://www.apple.com/ac/structured-data/images/knowledge_graph_logo.png,Enterprise,1976,"Apple is a global technology company designing and selling consumer electronics, operating systems, software platforms, and digital services, with market leadership in premium smartphones, personal computing devices, and an integrated ecosystem of hardware, software, and services.",Public,"One Apple Park Way, Cupertino, California, USA",United States; United Kingdom; China; India; Japan; Germany; France; Australia; Canada; Hong Kong,100+,"Cupertino, United States; Austin, United States; London, United Kingdom; Shanghai, China; Bangalore, India; Tokyo, Japan; Munich, Germany",161000,To make the best products on earth and leave the world better than we found it.,"To bring the best user experience to customers through innovative hardware, software, and services.",Innovation; Privacy; Quality; Sustainability; Inclusion; Customer focus,First $3T market cap company; Designs its own M-series and A-series chips,"2024,Launched Vision Pro spatial computing headset; 2023,Introduced M3 chip series for Macs",https://www.apple.com,https://www.linkedin.com/company/apple,@Apple,https://www.facebook.com/apple,https://www.instagram.com/apple,contact@apple.com,NA,GDPR Compliance; SOC 2; ISO 27001; CCPA Compliance,App Store antitrust and regulatory cases in US and EU,Carbon neutral corporate operations; Renewable energy sourcing; Supplier Clean Energy Program,TSMC semiconductor fabrication; Foxconn manufacturing; Global logistics providers,US-China trade tensions; Data privacy regulations; Export controls,Consumer spending cycles; Currency fluctuations; Global supply disruptions,Carbon neutral corporate operations with 2030 net-zero supply chain goal,Supplier Code of Conduct; Responsible Minerals Program,https://www.youtube.com/@Apple,Global enterprise IT adoption stories; Creative industry endorsements,"Extremely high-quality UX with strong product storytelling, localization, accessibility, and e-commerce integration",NA,Global Rank Top 10; US Rank Top 10,300000000,4.2/5,4.3/5,4.6/5,Fortune Most Admired Companies; Interbrand Best Global Brand; TIME Most Influential Companies,"Very Positive,premium brand perception and strong customer loyalty",Apple WWDC; CES; Global Developer Conferences,Secure personal computing; Mobile productivity; Digital entertainment access; Device ecosystem integration; Data privacy protection,Technology Hardware; Consumer Electronics; Media & Entertainment; Software Services; Financial Services,iPhone; Mac; iPad; Apple Watch; AirPods; iOS; macOS; App Store; Apple Music; iCloud; Apple TV+,Global Consumers; Enterprise IT Departments; Education Institutions; App Developers; Media Companies,Seamless ecosystem integration; Premium design and quality; Strong privacy and security; High-performance proprietary silicon,Proprietary silicon design; Closed-loop ecosystem; Premium brand positioning; Retail experience network,Brand loyalty; Vertical integration; Global retail presence; Software-hardware optimization,Premium pricing limits mass-market reach; Heavy reliance on iPhone revenue; Closed ecosystem restrictions,Regulatory scrutiny on App Store; Supply chain concentration in Asia; Services growth saturation,Samsung; Microsoft; Google; Huawei; Dell; HP; Sony; Meta,20% global smartphone shipments,Product-Led Growth,"No,highly diversified global consumer base",Strategic acquisitions and product ecosystem expansion,Higher margins than Samsung; Stronger ecosystem lock-in than Google; Comparable R&D to Microsoft,Revenue projected $420B by 2027,Services expansion; AR/VR ecosystem growth; Silicon innovation; Sustainability leadership,Consumer Technology Association; Business Roundtable; World Economic Forum,Enterprise Mac deployment at IBM; Education digital learning programs,Premium retail stores; Online direct sales; Enterprise partnerships,Generative AI integration; Spatial computing; Next-gen silicon,iPhone AI features; Vision ecosystem expansion; New Mac chipsets,$3T global consumer electronics and digital services market,$1T,25%,Paid leave; Parental leave; Wellness days,Health insurance; Mental wellness; OPD,Mostly fixed,High,RSUs; Performance bonuses,Dependents covered; Global health plans,Housing; Visa support; Travel reimbursement,Meals; Fitness; Wellness programs,"Engineering ~2,500 roles; Retail ~1,800 roles; Operations ~900 roles; AI/ML ~600 roles",10% annually ,6 years,35% women globally; Global DEI hiring programs,Innovation-driven; Collaborative,High,Moderate to High,Performance reviews; Continuous feedback,Inclusive hiring; Global DEI programs,Strong compliance; Transparency,Moderate,Limited restructuring; selective workforce adjustments,Very High,Renewable energy; Education initiatives; Supplier responsibility,Transparent and compliance-driven,$383B (FY2023),$97B (FY2023 Net Income),iPhone 52%;Services 22%;Mac 8%;iPad 7%;Wearables&Accessories 11%,$3T market capitalization,2%,Profitable,Vanguard Group; BlackRock; Berkshire Hathaway,IPO 1980; Ongoing public equity markets,$100M (IPO historical; equity markets thereafter),"Low,brand-driven and retail ecosystem","Very High,multi-device and service subscriptions",>30:1,<10%,70,"Not Applicable,cash-flow positive",NA,<1.0,Hybrid,Flexible,Occasional,Rare,Hybrid; On-site,Central business districts,Metro; Bus; Rail,Ride-hailing; Company transport,25 minutes,Tech hub,Secure; Well-lit,Workplace safety; Emergency transport,Fire compliant; Secure access,Medical teams; Fire drills,Tim Cook,https://www.linkedin.com/in/timothy-cook,"Tim Cook,CEO; Luca Maestri,CFO; John Ternus,SVP Hardware Engineering",Global alumni network; Venture capital ecosystem; Enterprise channel partners,"Low,centralized corporate procurement and structured enterprise sales channels",Tim Cook,CEO,tcook@apple.com.,(408) 996-1010,Tim Cook; Arthur D. Levinson; Al Gore; Monica Lozano,"$1,500 per employee/year",Excellent,Internal LMS; Leadership programs; Tech certifications,High,Senior leader mentoring; Peer programs,High,Merit-based; Transparent,Proprietary dev tools; Cloud platforms; AI tools,High,High,Global products; Revenue-driving,Balanced,High,Engineering; Design; Marketing,Mature enterprise,Top-tier global brand,Global consumers; Fortune 500 enterprises,Big Tech; Startups; Global enterprises,Very High,Elite employer brand,Global alumni network; Executive leadership,International teams; Global markets,TSMC; Foxconn; Broadcom; Qualcomm; SAP,M-series chips; iOS and macOS; Face ID; Retina display technology,$30B annually,"High,on-device AI, Siri, Vision Pro spatial computing, generative AI integration",Swift; Xcode; iCloud infrastructure; SAP ERP; Proprietary silicon,ISO 27001; SOC 2; Secure Enclave architecture,TSMC; IBM; SAP; Nike; Goldman Sachs,Enterprise Leader; Innovation Pioneer
27,Schneider Electric,Schneider Electric ,https://upload.wikimedia.org/wikipedia/commons/thumb/0/0e/Schneider_Electric_Logo.svg/2560px-Schneider_Electric_Logo.svg.png; https://www.se.com/ww/eNAssets/564/document/527555/presentation-Q3-revenues-2025.pdf (logo in doc); https://www.se.com/ww/eNAssets/common/img/logo-schneider-electric.svg; https://corporate.se.com/sites/default/files/2025-01/SE_Logo.png; https://www.se.com/content/dam/secom/en_us/assets/images/logo-schneider-electric.png,Public Enterprise ,1871,"Schneider Electric is a global leader in energy management and automation, providing digital solutions for efficiency, sustainability, electrification, automation, and digitalization across industries, buildings, data centers, infrastructure, and homes. It operates in over 100 countries with a strong focus on net-zero and energy transition technologies.",Public ,"Rueil-Malmaison, France ",France; United States; China; India; Germany ,100+,"Boston, United States; Shanghai, China; Bangalore, India; Grenoble,France","150,000–160,000",To be your digital partner for Sustainability and Efficiency.,"We provide energy and automation digital solutions for efficiency and sustainability. We combine world-leading energy technologies, real-time automation, software and services into integrated solutions for Homes, Buildings, Data Centers, Infrastructure and Industries. ",Learning; Diversity; Inclusion; Sustainability; Integrity; Empowerment ,Originally founded in 1836 as a steel and armaments firm; shifted entirely to electricity in the late 20th century.,Recently announced a major €3 billion share buyback program and expanded partnership with NVIDIA for data center AI solutions.,https://www.se.com/,https://www.linkedin.com/company/schneider-electric/,@SchneiderElec,https://www.facebook.com/SchneiderElectric,https://www.instagram.com/schneiderelectric/,global-communications@se.com,1800-103-0011,"REACH, RoHS, ISO 14001, GDPR and active in ESG reporting frameworks.","Limited major controversies; occasional regulatory, environmental, or labor-related cases.",MSCI ESG Rating: AAA; CDP A-List for Climate and Water.,Global manufacturing base with focus on regionalizing supply for resilience,U.S.–EU tariffs; Global trade tensions,Fluctuations in global construction cycles and raw material prices,Aiming for carbon neutral operations by 2025 and net-zero across the value chain by 2050.,Vigilance plan covers all suppliers; high scores in ethical supply chain audits.,https://www.youtube.com/@SchneiderElectric,https://www.se.com/ww/en/work/campaign/customer-success-stories.jsp,Excellent,4.7/5,4500,6.5+ million,4.1/5,4.0/5,4.2/5,"World’s Most Sustainable Corporation, Gartner Supply Chain Top 25.",Positive,"Innovation Summit, COP summits, Hannover Messe, CES ",Energy inefficiency; Carbon emissions; Legacy industrial automation; Power reliability; Data center cooling; Home energy costs ,"Energy Management, Industrial Automation, Data Centers, Residential, Infrastructure","EcoStruxure platform, medium & low voltage switchgear, industrial PLC systems, UPS, building management systems.","Major utilities, cloud service providers (data centers), industrial manufacturing firms, and construction companies.",Providing integrated digital solutions for energy and automation to achieve efficiency and sustainability.,Deepest portfolio in both energy management and automation through a unified digital platform .,Global leader in energy management; early mover in sustainability software (AVEVA acquisition); strong global supply chain.,Complex integration of multiple legacy brands; facing high competition in specialized SaaS niches.,Accelerating the transition to digital-first services while managing high raw material costs for hardware.,"Siemens, ABB, Eaton, Rockwell Automation, Emerson Electric, Honeywell",8–10% of global energy management and automation solutions,Direct sales to large accounts; indirect sales through a massive global network of distributors and contractors.,Low,IPO-listed and publicly traded since 1999,Above average,Target of 7-10% organic revenue growth annually through 2027.,"Electrification, Digitalization, Decentralization of energy, and accelerating Software services.","UN Global Compact, RE100, EP100, World Business Council for Sustainable Development.","Digitalizing the Burj Khalifa's energy systems; massive microgrid project for Montgomery County, USA.",Leveraging EcoStruxure as the central digital offer to upsell hardware customers into software services.,"Focus on Electricity 4.0, bidirectional EV charging, and AI-managed green hydrogen systems.",Next-gen SF6-free switchgear and expanded home energy management suites.,$250–300 billion,$90–120 billion,$10–15 billion,Generous,Comprehensive ,85% fixed / 15% variable,High,Worldwide Employee Stock Ownership Plan cited as a key benefit; high participation rate ,Comprehensive family coverage,Full relocation support,Comprehensive wellness and employee well-being programs,High ,10-12% ,8-10 years,30–35%,"Inclusive, purpose-driven, and focused on Life is On philosophy.",High,High,Continuous feedback encouraged through digital performance tools.,High,High,Low,Minimal layoffs,High ,Sustainability embedded in business strategy; Customer CO? avoidance outcomes cited; Supplier emissions reduction focus ,Proactive and organized,€35.9 billion,€4.0 billion ,EnergyManagement:77%;IndustrialAutomation:23%,€115+ billion ,8–12%,Highly Profitable,"Publicly traded with institutional investors including Amundi, BlackRock, and Norges Bank",No recent funding round,NA,Medium–High,Medium–High,1.0:4.0,5–7%,50,?40–60 crore / month,24–36 months,1.3x,Hybrid,8–9 hrs/day,Low,Rare,Hybrid ,Central,Excellent,Varies by region; focus on green mobility and EV transport for staff.,30-45 minutes ,Industrial–business zone,Very safe,"Comprehensive health, safety, and environmental policies",High,On-site safety wardens and digitized emergency notification systems.,Peter Herweck ,https://www.linkedin.com/in/peter-herweck/,"Peter Herweck (CEO); Hilary Maxson (CFO); Olivier Blum (EVP, Energy Management) ","Schneider Electric Exchange platform, University partner programs, and industrial innovation summits.",High-Medium,Peter Herweck,Chief Executive Officer,contact@se.com,1800-103-0011,Jean-Pascal Tricoire (Chairman); Peter Herweck (CEO); Fred Kindle (Lead Independent Director),"?50,000–?70,000 per employee / year",High,Strong,Very High ,Strong and well-established,High,High,Excellent ,Very well-defined with documented responsibilities,High ownership culture supported by trust and autonomy,High impact,Balanced with structured execution,High,Wide exposure across departments,Mature,Strong and respected,Global blue-chip customers; Major utilities; Cloud giants; Fortune 500 industrial firms,"Good exits into industrial, energy, and sustainability sectors",Highly relevant for long-term careers,Strong,Strong,Very high,"Microsoft , AWS, Salesforce, NVIDIA , Capgemini","Medical device patents, health informatics software, AI diagnostics IP",5–6% of revenue,High,"Java, C++, Python, Azure Cloud, Salesforce, SAP, AVEVA industrial software suite.",Strong,"One of the industry’s largest: 650,000+ partners including distributors, system integrators, and contractors.",High
15,Llama Logisol Private Limited,Shipsy,https://shipsy.io/wp-content/themes/shipsy/images/round-logo.png; https://shipsy.io/wp-content/themes/shipsy/images/homepage/home-banner.svg,Startup,2015,"Shipsy is a SaaS-based AI-powered logistics management platform that provides end-to-end supply chain and logistics solutions, including transportation management, warehouse management, and automation for global enterprises, serving over 150 customers in 30+ countries and processing 250M+ shipments monthly.",Private Limited ,"Vatika Business Park, Tower 1, Gurgaon, Haryana, India",India; United Arab Emirates; Saudi Arabia; Hong Kong; United Kingdom; Netherlands; Australia; Indonesia,8,"Gurgaon, India; Bangalore, India; Mumbai, India; Dubai, United Arab Emirates; Riyadh, Saudi Arabia; London, United Kingdom; Amsterdam, Netherlands; Sydney, Australia",331-350,Become the de-facto global logistics operating system,To empower enterprises with AI-native platforms for autonomous supply chains,Customer Obsession; Innovation; Transparency; Excellence; Integrity; Collaboration; Sustainability,Tracks 180K+ containers; Powers 250M+ shipments monthly; Procures $350M+ freight; Acquired Stockone in 2023; 80% YoY growth in 2024,"Apr 2025: Aramex partnership, new CTO/CRO; Jun 2025: Australia HQ in Sydney; Mar 2025: Gartner Niche Player; Jul 2024: Netherlands expansion; Acquired Stockone 2023",https://shipsy.io,https://www.linkedin.com/company/shipsy,@shipsyio,https://www.facebook.com/Shipsy.io,https://www.instagram.com/shipsy.io,contact@shipsy.io,+91 124 400 8700,GDPR; SOC2; BSI,None reported,Carbon emissions tracking; Sustainability insights,Tech partners like Tech Mahindra; ERP integrations,Regulatory changes; Trade tariffs,Fuel price volatility; Global recessions; Supply chain disruptions,850KT+ saved,Responsible vendor onboarding,https://www.youtube.com/watch?v=P7l42R9F51k,NA ,"Professional design with clear UX, focused messaging on AI logistics, high clarity",NA,"Global:50,000; India:4,000","101,609 (LinkedIn) + others 150,000 total",4.2/5,4.8/5,4.9/5 ,Gartner Magic Quadrant Niche Player 2025; Customers’ Choice in Gartner Peer Insights 2024,"Positive (4.8/5) - Strong Gartner rating, growth trajectory",Gartner TMS events; Logistics conferences; Middle East Tech Summit; Australia expansion launch,Inefficient logistics processes; Lack of visibility in supply chain; High operational costs; Manual operations; Environmental sustainability; Complex multi-modal transportation,Logistics & Transportation; Retail & E-commerce; Manufacturing; Automotive; FMCG,Transportation Management System; Warehouse Management System; Route Optimization; Shipment Tracking; Freight Procurement; Last-Mile Delivery; Courier Aggregator; On-Demand Delivery Management,Logistics: DHL; DPD; Hellmann; Retail: Pizza Hut; KFC; Pepsi; Manufacturing: Kelloggs; Americana; E-commerce: Flipkart,AI-powered automation; Real-time visibility; Cost reduction; Sustainability focus; Seamless integrations,AI-native platform; Gartner recognition; Global scale; Multi-modal management; Environmental impact tracking,"Extensive partner network (190+ 3PLs, 300+ forwarders); SOC2/GDPR compliant; Gartner Niche Player; Real-time analytics; Scalable SaaS",Limited scale in new markets like US/Europe; Dependency on carrier integrations; High competition from global players; Acquisition integration risks,Scaling AI adoption; Regulatory compliance across countries; Data privacy concerns; Competition from established players,Locus; FarEye; project44; Descartes; ShippyPro; ProShip; ShipSoft-Parcel; Centiro; MetaPack; Route4Me; Onfleet,5-10% in India logistics SaaS,Product-Led Growth + Field Sales,No (>20% from single client),Acquired (status); Stockone acquisition 2023,Higher growth than Locus; Stronger AI than FarEye; Gartner recognition similar to Descartes,Revenue growth 50% annually,AI innovation; Global expansion; Sustainability; Partnerships; Talent acquisition,Nasscom; CII Logistics Council,Reduced costs for DHL; Optimized routes for Pizza Hut; Visibility for Aramex,Digital marketing; Partnerships; Enterprise sales; Webinars; Content marketing,AI co-pilot; Emissions reporting; Dynamic optimization,AI demand forecasting; Address learning; Incident management AI,$50B+ Global Logistics SaaS,$10B enterprise TMS/WMS,NA,20+ PTO; Sick leave; Mental health days,Comprehensive insurance; OPD; Mental health,80/20 fixed/variable,Annual performance-based,ESOPs standard; Vesting over 4 years,Employee + dependents; Comprehensive,Assistance provided,Meals; Gym; Wellness programs,Software Engineers: 3; Logistics Specialists: 2; Sales: 1; Product: 1; Operations: 1,12-15%,3 years,Gender balanced hiring; DEI initiatives (30% women est.),Collaborative; Innovative; Customer-focused,Coaching and growth-oriented,High,Continuous; Constructive,Active DEI; Gender balance initiatives,High integrity; Transparency,Low,None recent,High,Carbon reduction; Ethical practices,Adaptive,$27.1M,Loss-making ,RecurringSaaS80%;Services20%,$122M,80%,Loss-making,A91 Partners; Z3Partners; Sequoia Capital; Info Edge Ventures; Peak XV Partners,Series B $25M Feb 2022; Series A $6M Nov 2020; Seed $1M Nov 2019,$32.9M,"$5,000-10,000","$50,000+",NA,8-12% ,45+,$1-2M monthly,18-24 months,1.5x,Hybrid (50% remote),9-6 flexible,Occasional during launches,Rare,Hybrid; Remote options; Global team support,Gurgaon IT hub ,Metro; Buses; Auto-rickshaws,Uber/Ola abundant; Company cabs for late hours,30-45 min from Delhi IGI,Tech park,High daytime; Moderate nighttime,Late-night transport; Women safety,High standards; Security,Fire drills; Medical kits; Trained staff,Soham Chokshi,https://www.linkedin.com/in/sohamchokshi,"Soham Chokshi,CEO; Rishabh Nigam,Co-founder; Abhishek Sharma,VP Engineering",Shared investors: Sequoia Capital; Alumni from IIT; Board networks,Medium - Through LinkedIn and events,Soham Chokshi,CEO,sales@shipsy.io,NA,Soham Chokshi; Himanshu Gupta; Dhaval Sharma; Anita Bhatia; Rolf van Oostrom; Elena Solomonova,INR 4 crore annually,High,Certifications; Coursera; Internal workshops,High - Real logistics problems,Available; Programs,High,Merit-based; Transparent,AI tools; Modern software,High,High,Customers; Revenue,60/40 execution/thinking,High,Multiple teams; Projects,Scale-up,Strong in logistics SaaS; Good resume,Fortune 500; High-standing,Tech firms; Logistics companies,High,High,Strong alumni; Investors,High - 30+ countries; Cross-border,Tech Mahindra; SAP; Oracle NetSuite; Microsoft Dynamics; AWS,Logistics optimization algorithms; Control tower analytics,15-20% of revenue,"High - AI-driven automation, demand forecasting, route optimization","AI platforms; Cloud-based SaaS; Integrations with SAP, Oracle; AWS",SOC2 compliant; No breaches found,Aramex; 64 shipping lines; 190 3PLs; 300 forwarders,High AI maturity; Above average in cloud adoption
NA,Speculative AI Labs,SpecAI,NA,NA,NA,NA,Privately Held Company,NA,NA,NA,NA,15-25 (estimated based on LinkedIn),NA,NA,NA,NA,NA,NA,NA,NA,NA,NA,NA,NA,NA,NA,NA,NA,NA,NA,NA,NA,NA,NA,NA,NA,NA,NA,NA,NA,NA,NA,NA,NA,NA,NA,NA,NA,NA,NA,NA,NA,NA,NA,NA,NA,NA,NA,NA,NA,NA,NA,NA,NA,NA,NA,NA,NA,NA,NA,NA,NA,NA,NA,NA,NA,NA,NA,NA,NA,NA,NA,NA,NA,NA,NA,NA,NA,NA,NA,NA,NA,~$1.5M (inferred from employee size),NA,NA,$10M (speculative Series A pitch),NA,NA,NA,NA,NA,NA,NA,NA,NA,NA,NA,NA,NA,NA,NA,NA,NA,NA,NA,NA,NA,NA,NA,NA,NA,NA,NA,NA,NA,NA,NA,NA,NA,NA,NA,NA,NA,NA,NA,NA,NA,NA,NA,NA,NA,NA,NA,NA,NA,NA,NA,NA,NA,NA,NA,NA,NA,NA,NA,NA,NA,NA,NA,NA,NA,NA,NA
