29,Zerodha Broking Limited ,Zerodha,https://zerodha.com/static/images/logo.svg; https://upload.wikimedia.org/wikipedia/commons/thumb/9/9a/Zerodha_Logo.svg/1200px-Zerodha_Logo.svg.png; https://play-lh.googleusercontent.com/8zqJ0ZfZfZfZfZfZfZfZfZfZfZfZfZfZfZfZfZfZfZfZfZfZfZfZ; https://zerodha.com/static/images/zerodha-logo.png; https://www.zerodha.com/static/images/social/zerodha-logo.png,Startup,2010,"Zerodha is India's largest discount brokerage firm offering zero brokerage on equity delivery and flat ?20/order for intraday/F&O, with platforms like Kite (trading), Coin (mutual funds), and Varsity (education). Bootstrapped and profitable, it focuses on low-cost, tech-driven investing for retail users, serving millions while pioneering transparency and education in Indian markets. Facing regulatory pressures on F&O, it plans US stock trading via GIFT City in early 2026.",Private,"153/154, 4th Cross, J.P Nagar 4th Phase, Opp. Clarence Public School, Bangalore, Karnataka 560078, India",India,5–10,"Bangalore, India; Mumbai, India; New Delhi, India; Ahmedabad, India; Chennai, India; Hyderabad, India; Pune, India; Kochi, India; Salem, India","1,200–1,500",To build the best ecosystem for retail investment and trading in India through technology and education. ,"To break all barriers that traders and investors face in India in terms of cost, support, and technology. ",Transparency; Frugality; Customer-First; Long-term thinking; No Marketing/No Sales team ,100% bootstrapped; No marketing department; Founders are among India's richest self-made individuals.,Rainmatter; Smallcase; Ditto,https://zerodha.com ,https://www.linkedin.com/company/zerodha/,@zerodhaonline,https://www.facebook.com/zerodhaonline,https://www.instagram.com/zerodhaonline/,press@zerodha.com ,080 4719 2020,"Highly regulated, compliant with SEBI, NSE/BSE, and financial market regulations.",Occasional regulatory observations and customer complaints; no major legal scandals.,Climate action; Livelihoods; Afforestation; Water conservation; Sustainable agriculture,Heavily dependent on AWS for cloud infra and Indian exchanges (NSE/BSE) for trade execution.,US–China trade tensions; Capital market regulations,Indian market volatility; SEBI regulatory changes on True-to-label pricing.,"Rainmatter Foundation commits ?1,000 Cr to climate change and environmental sustainability ","Founder-led non-profit supporting climate solutions, grassroots environmental work, and sustainable livelihoods ",https://www.youtube.com/@zerodhaonline,https://www.youtube.com/results?search_query=zerodha+customer+review,Excellent,1.4/5,Top 100 in India,1.7+ million,4.0 / 5  ,3.8 / 5,4.4 / 5,Forbes India Leadership Awards; Economic Times Startup of the Year; NSE Best Broker Award ,Excellent; trusted by millions as an ethical brokerage.,Active presence in FOSS United; Organizing FOSS conferences in India. ,High brokerage costs for retail investors; Lack of financial literacy (Varsity); Complex trading interfaces.,Fintech / Stock Brokerage,Equity Trading; Commodity/Currency Trading; Mutual Funds; Educational Content; Wealth Management Ecosystem ,Retail investors; HNI (High Net-worth Individuals); Professional traders; Millennials ,Transparency; Frugality; Customer-First; Long-term thinking; No Marketing/No Sales team ,Kite (Mobile & Web Trading); Console (Back-office); Sentinel (Price alerts); GTT (Good Till Triggered) ,Coin (Direct Mutual Funds); GoldenPi (Bonds); Ditto (Insurance advisory - partner); Sensibull (Options trading - partner) ,Platform outages during peak market hours and limited advisory services are key gaps.,Managing massive concurrent users during market peaks; handling millions of orders with zero downtime.,Upstox; Groww; Angel One; ICICI Direct; HDFC Securities; Kotak Securities ,18–20% of India’s retail stock brokerage (by active clients),Zero marketing / sales team; growth driven purely by word-of-mouth and product quality.,Low,Independent and bootstrapped since 2010,Top-tier outperformer,US stock trading via GIFT City; Wealth management expansion.,User-feedback driven; focused on simplicity and solving core investor problems.,FOSS United; SEBI/Exchange committees.,"Founder-led non-profit supporting climate solutions, grassroots environmental work, and sustainable livelihoods ",Team offsites focusing on nature/wellness; Internal hobby groups; Zero-marketing internal celebrations. ,"Risk management engines, real-time margin calculations, and order matching logic.",US stock trading via GIFT City; expansion of Rainmatter portfolio.,$25–30 billion,$8–10 billion,$2–3 billion,Generous,Mental health support; Paid leaves for wellness; Strong fitness culture promoted by founders.,90% fixed / 10% variable,High,Founder-led buybacks and profit-sharing; traditionally avoided standard ESOP models for a long time.,Comprehensive family coverage,Minimal relocation support,Good wellness and fitness benefits,Low to Moderate,8–12%,5+ years,25–30%,"Quiet, ethical, product-driven, frugal, and highly technically competent.",High,High,"No-nonsense, transparent, and educational; Highly public-facing ",Medium,High,Low,No layoffs,High ,Significant investment in climate change through the Rainmatter Foundation.,Transparent and steady,"?8,370 Crore","?4,700 Crore","Brokerage&Trading(90%),AncillaryServices(10%)",$3.6+ Billion ,15–20%,Highly profitable; India's most profitable standalone fintech.,Bootstrapped and founder-funded with no external venture capital,No external funding,NA,Low,High,1.0:7.0,3–5%,70,?5–10 crore / month,36+ months,0.8x,remote or hybrid,8–9 hrs/day,Low,Rare,Highly flexible; Large parts of the team are permanent remote or hybrid,Central,High,NA,60 - 90 minutes.,IT corridor,Very safe,Strong data security and workplace safety policies,High,Standard fire safety and disaster recovery for trading infrastructure.,Nithin Kamath,https://www.linkedin.com/in/nithinkamath/,Nithin Kamath (CEO); Nikhil Kamath (CIO); Kailash Nadh (CTO); Venu Madhav (COO); Hanan Delvi (CPO); Seema Patil (Director) ,Founder ecosystem; Open source community interactions.,High,Nithin Kamath,Founder & CEO,support@zerodha.com,080 4719 2020,Nithin Kamath; Nikhil Kamath; Seema Patil ,"?30,000–?40,000 per employee / year",High,Strong,High,Strong and founder-led,High,High,Access to AWS cloud and high-performance financial engineering tools.,Highly transparent and well-communicated,Very strong ownership mindset from early stages,Very high impact,Strong execution with clear thinking,High,Strong exposure across functions,Mature,Highly trusted,Mass retail; 10 million+ active users across India.,Excellent exits into fintech startups and leadership positions,Highly relevant and in-demand,Very strong,Very strong,Low,Rainmatter; Streak ; Sensibull; Smallcase; Tijori ,"Data storage patents, HAMR technology, firmware and controller IP",4–5% of revenue,High,Managing 10 million+ active clients; Processing millions of orders daily; 100% cloud-hosted infra,Strong,Rainmatter partners; Smallcase; Ditto; GoldenPi; Sensibull.,High
33,"ZS Associates, Inc.",ZS,https://www.zs.com/content/dam/zs-site/images/logos/zs-logo.svg,Private Management,1983,"ZS Associates is a global management consulting and technology firm specializing in data-driven strategy, analytics, and digital transformation, particularly for healthcare, life sciences, and consumer industries.",Private,"Evanston, Illinois, United States",United States; India; United Kingdom; Germany; Switzerland; China; Japan; Hong Kong,35+,"Evanston, United States; Chicago, United States; Boston, United States; Bangalore,India; Pune,India; New Delhi,India; London,United Kingdom; Zurich,Switzerland",13000,To help clients win by delivering data-driven solutions that matter,To improve life and how we live it through powerful analytics and human ingenuity,Client impact; Collaboration; Innovation; Integrity; Personal growth,Majority employee-owned firm; Known for strong internal learning programs,Continued AI platform investments; Expansion of India delivery centers in 2024,https://www.zs.com,https://www.linkedin.com/company/zs-associates,@ZSAssociates,https://www.facebook.com/ZSAssociates,https://www.instagram.com/zs_associates,inquiries@zs.com,18474923600,GDPR; HIPAA; ISO 27001,NO ,DEI initiatives; sustainability reporting; pro-bono healthcare work,Cloud providers; data vendors,Healthcare regulation changes,Consulting spend cycles; pharma pricing pressure,Low; digital-first operations,Responsible vendor selection,https://www.youtube.com/@ZSAssociates,Global pharma executive testimonial,high,8.5/10,45000,600000,4.2/5,4.3/5,4.4/5,Fortune Best Workplaces in Consulting; Great Place to Work India,High,HLTH Conference; Pharma AI Summits; Analytics conferences,Commercial strategy gaps; Data fragmentation; Sales effectiveness; Digital transformation challenges,Life Sciences; Healthcare; Consumer Products; High Tech; Private Equity,Sales & Marketing Strategy; Advanced Analytics; AI Solutions; Pricing & Revenue Management; ZS Platform,Global pharma companies; Healthcare providers; Fortune 500 consumer firms,Deep analytics expertise; Industry specialization; End-to-end strategy-to-execution delivery,Strong healthcare focus; Proprietary analytics platforms; Consultant–technologist hybrid model,Domain expertise; Scalable analytics teams; Global delivery centers,Heavy healthcare revenue concentration; Long project cycles,Talent retention; Scaling AI products; Consulting margin pressure,McKinsey Analytics; Bain Advanced Analytics; Accenture Strategy; IQVIA,8% global healthcare analytics consulting,Relationship-led consulting sales,Medium,Long-term private partnership,Stronger healthcare depth than Accenture; smaller scale than McKinsey,Continued double-digit growth through AI platforms,AI-driven consulting; healthcare expansion; platform scaling,HIMSS; Analytics Society; NASSCOM,Global pharma sales optimization; AI-driven market access programs,Thought leadership; client referrals; account-based selling,GenAI analytics tools; autonomous sales optimization,ZS AI Studio; Next-gen analytics platforms,$200 Billion,$60 Billion,5%,Generous PTO; parental leave,Premium health insurance; wellness programs,80% fixed; 20% variable,Medium–High,Profit-sharing partnership model,Spouse; children,Yes,Wellness allowances; flexible work,Analytics & Data Science 35%; Consulting 30%; Technology 20%; Operations 10%; Corporate 5%,14%,4.5 years,Women 40%; strong inclusion programs,Collaborative; analytical; client-impact driven,High,High,Continuous,"Strong, measurable programs",Very high,Medium,Limited and localized,Very high,Healthcare impact initiatives,Transparent; people-first,$3.5 Billion ,NA,Consulting70%;Analyticsplatforms30%,$10 Billion ,12%,Profitable,Employee owned partnership,NA,NA,high,high,33.40%,6%,60,NA,NA,<1,Hybrid,9–10 hrs,Occasional,Rare,Hybrid,Central business districts,Excellent,Corporate cab support,50 mins,Business districts,High,Workplace safety; travel security,Modern; compliant,Global crisis response protocols,Praneet (Neeraj) Mehta,https://www.linkedin.com/in/neerajmehta,"Chad McCoy,Chief Legal Officer; Steve Zeller,Managing Principal",Alumni network; Healthcare client referrals; Academic partnerships,Medium,NA,NA,NA,NA,Internal managing principals,$80 Million annually,Excellent,"Strong,formal training academies",Very high,Formal mentorship programs,High,Transparent; merit-based,Best-in-class analytics tools,High,Medium,High ,Balanced,High,Consulting; analytics; tech,Mature private firm,Very strong,Global Fortune 500,Top consulting firms; industry leadership roles,Extremely high,Strong,Very strong alumni network,High,AWS; Microsoft Azure; Google Cloud; Snowflake; Databricks,Proprietary analytics models; ZS Platform IP,$300 Million annually,High,Python; R; AWS; Azure; Snowflake; Tableau,ISO-aligned; enterprise-grade security,Pharma tech vendors; cloud platforms; academic institutions,average
34,FLAM Gaming Private Limited,FLAM,https://www.flamapp.com/assets/flam-logo.svg,Startup,2023,"FLAM is a mobile-first gaming and entertainment startup focused on social, creator-led, and interactive gaming experiences designed for Gen Z and emerging digital-native audiences.",Private,"Bangalore, Karnataka, India",India,0,"Bangalore, India; Gurgaon, India; Noida, India; Palo Alto, United States; Vancouver, Canada",60,To build the world’s most engaging social gaming platform,"To bring people together through interactive, creator-driven gaming experiences",Creativity; Speed; Community-first; Innovation; Ownership,Founded by former Swiggy and gaming industry leaders,Seed funding announced in 2023; Platform beta expansion in 2024,https://www.flamapp.com,https://www.linkedin.com/company/flamapp,@flamapp,https://www.facebook.com/flamapp,https://www.instagram.com/flamapp,hello@flamapp.com,NA,IT Act compliant; App store policies,no,Digitalfirst; low environmental footprint,Cloud infrastructure providers,App regulation changes,Gaming regulation; advertising downturn,Minimal,Responsible ad practices,https://www.youtube.com/@flamapp,Creator success story testimonials,High,NA,650000,120000,4.0/5,NA,4.2/5,Startup accelerator demo day finalist,high,Startup India events; Gaming expos; Creator economy meetups,Low engagement in casual gaming; Lack of creator-led gaming platforms; Limited social interactivity in mobile games,Mobile Gaming; Social Gaming; Creator Economy; Entertainment,FLAM Mobile App; Social Multiplayer Games; Creator-led Game Experiences; Live Interactive Games,Gen Z consumers; Casual gamers; Content creators; Influencers,Social-first gaming; Creator monetization; Lightweight mobile games with high engagement,Creator-led gaming; Social interaction focus; Fast game iteration cycles,Strong Gen Z appeal; Low-latency mobile tech; Creator ecosystem integration,Early-stage monetization; Limited global reach; Small content library,Scaling user base; Retention; Monetization stability; Platform differentiation,MPL; WinZO; Zupee; Loco; Gamezop,<1% (Indian social gaming),Product-led growth (PLG),No,Acquisition by gaming or media company,Faster innovation than legacy gaming apps; smaller scale than MPL,5–10M users by 2026,User growth; monetization; creator tools,IAMAI; Startup India,Viral creator-led game campaigns,Influencer marketing; social media growth,Live multiplayer formats; creator monetization,Competitive social games; creator studios,$12 Billion ,$3 Billion,1%,Flexible PTO,Health insurance,85% fixed; 15% variable,Low,ESOPs offered,Limited,Limited,Flexible work; wellness stipend,Engineering  35%; Product 20%; Game Design 20%; Marketing 15%; Operations 10%,10%,1.8 years,Women 28%; inclusive hiring practices,Fast-paced; experimental; creative,Medium,Medium,Continuous,Improving,High,Medium,None reported,High,Minimal but responsible,Adaptive; founder-led,$1 Million ,NA,Ads60%;In-apppurchases40%,$25 Billion,120%,Loss,Accel India,$4.5M ,$4.5 Million,low,low,8.3:1,30%,48,$200K,18 months,1.6,Hybrid,9–10 hrs,Occasional,Rare,Hybrid,Central tech hub,Good,Reimbursement,60 mins,Startup hub,High,Standard workplace policies,Modern office setup,Basic startup protocols,Kushagra Kohli,https://www.linkedin.com/in/kushagrakohli,"Abhishek Haldar ,Anuj Tandon ",Accel alumni network; Indian startup ecosystem; Creator partnerships,High ,NA,NA,NA,NA,Accel representatives; gaming industry advisors,$250K annually,Good,Strong peer learning,High,Founder driven,Medium,Merit-based,Modern dev tools,Medium,Very high,High,Execution heavy,Medium,High,Early-stage startup,Growing,Mass-market consumers,Gaming startups; consumer tech,High,Growing,Strong startup ecosystem,Low,AWS; Firebase; Unity; Google AdMob,Game mechanics; social interaction frameworks,45% of spend,Medium ,Unity; C; AWS; Firebase; Node.js; React,Standard startup security practices,Influencers; content creators; ad networks,average
37,Consilio LLC,Consilio,https://upload.wikimedia.org/wikipedia/commons/9/93/Consilio_logo.png,Private Legal Technology & Services,2000,"Global provider of legal technology, eDiscovery, document review, flexible legal talent, and legal transformation consulting services",Private,"Washington, DC, United States",United States; United Kingdom; India; Germany;  France; Spain;  Italy;  Brazil;  China;  Hong Kong;  Australia,16,"London,United Kingdom;Frankfurt,Germany;Hong Kong,Hong Kong;Bangalore,India;New York,United States;Chicago,United States;Los Angeles,United States",5400,To modernize and transform the legal industry through technology and innovation,"Enable legal teams to work smarter, faster, and more securely","Client focus, integrity, innovation, collaboration",One of the largest managed document review providers globally,Expansion of AI-enabled legal review capabilities (2024–2025),https://www.consilio.com,https://www.linkedin.com/company/consilio,https://twitter.com/Consilio,https://www.facebook.com/Consilio,NA,info@consilio.com,NA,"GDPR, ISO-aligned, SOC-compliant",None publicly significant,Internal ESG initiatives,Minimal,Cross-border data regulations,"Litigation slowdown, regulatory changes",Internal sustainability programs,Vendor compliance standards,https://www.youtube.com/@BTGroup,Large law firm endorsements,High,4.5/5,NA,"60,000+",3.6 / 5,3.5 / 5,4.2 / 5,"Chambers Innovation Awards, LegalTech recognitions",Positive,"LegalTech, ILTA, Relativity Fest","Complex data volumes, litigation cost pressure, regulatory compliance, cybersecurity risk, inefficient document review","Legal Services, Financial Services, Healthcare, Energy, Government, Technology","Discovery, Managed Document Review, Legal Analytics & AI, Cyber Incident Response, Legal Operations Consulting, Flexible Legal Talent","AmLaw 100 law firms, Fortune 500 enterprises, Government agencies","End-to-end legal solutions combining technology, expertise, and scalable global delivery","Integrated tech + legal talent model, global delivery scale, AI-driven workflows","Global footprint, deep legal domain expertise, strong enterprise trust",Heavy reliance on litigation-driven demand cycles,"Rapid AI evolution, increasing competition from pure-play legal AI startups","Relativity, Epiq, KLDiscovery, Exterro",22.7%–28.3%,Enterprise B2B,Moderate,PE-backed growth model,Above industry average,Continued AI-driven growth,"AI automation, global expansion","ILTA, LegalTech associations",Fortune 500 litigation support,Enterprise relationships,Advanced legal AI and analytics,AI review enhancements,NA,$200 billion,NA,Standard corporate,Insurance + EAP,Mostly fixed,Moderate,Leadership roles,Yes,Case-based,Standard,High,15%,3 years,NA,"Professional, delivery-focused",Mixed (role/team dependent),Moderate,Developing,High,High,Moderate,Limited,Clear,Growing focus,Stable and structured,Estimated $1B+,NA,Services-led with technology enablement,NA,8–12%,Profitable ,Private Equity (GI Partners – historical),NA,NA,NA,High,1 : 12 - 1 : 18,1.2% per month,50+,NA,NA,NA,Hybrid,9–10 hrs/day,Project-based,Rare,Hybrid,Central business districts,Good,Project-dependent,30–60 minutes,Commercial,High,Established,Strong,Standard,Andy Macdonald,https://www.linkedin.com/in/andymacdonald,"COO, CTO, Chief Innovation Officer (various regional heads)","Legal conferences, law firm partnerships, LinkedIn networking",Medium,NA,NA,NA,NA,Standard complete data for board_members,Moderate,Standard,Moderate,High for legal tech,Team-based,Moderate,Moderate,Strong,Clear,Medium,High,Execution-heavy,High,Moderate,Mature,Strong,High,Strong legal tech careers,High,High,Strong,Very High,"Relativity, Microsoft, AWS",Proprietary workflows and analytics models,Moderate,High,"Relativity, AWS, Microsoft Azure, proprietary AI",Strong,"Legal tech vendors, law firms",Top-tier legal services provider
41,Fidelity Investments,Fidelity,https://upload.wikimedia.org/wikipedia/commons/5/5e/Fidelity_Investments_logo.svg,Financial Services / Asset Management,1946,"Global financial services firm offering investment management, retirement services, brokerage, and wealth management",Private Company (Family-owned),"Boston, Massachusetts, USA",United States; Canada; United Kingdom; India,200+,"Boston,United States; Durham,United States; Westlake,United States; Jersey City,United States; London,United Kingdom ; Bangalore,India; Chennai,India",74000,To strengthen the financial well-being of customers and deliver better outcomes,Enable long-term financial confidence,Integrity; Client focus; Innovation; Trust,Launched first zero-expense-ratio index funds,Expansion of digital assets and AI personalization,https://www.fidelity.com,https://www.linkedin.com/company/fidelity-investments/,https://twitter.com/Fidelity,https://www.facebook.com/fidelityinvestments,https://www.instagram.com/fidelity/,mediarelations@fidelity.com,617 563 7000,SEC; FINRA; FCA; GDPR,Minor regulatory settlements historically,MSCI AA,Cloud & data vendors,Medium,Medium,Net-zero commitments,Supplier responsibility code,Fidelity YouTube,High retail trust,Excellent,4.6/5,Top 5M,3M+,4.2/5,4.3/5,4.4/5,Fortune Best Places to Work; Top Asset Manager,80/100,WEF; industry conferences,Investment complexity; retirement planning; digital investing access,Asset Management; Brokerage; Retirement; Wealth Management,Mutual funds; ETFs; Brokerage; 401(k); IRAs; Wealth advisory,Retail investors; institutions; employers; RIAs,Helping people invest smarter and plan better for the future,Privately held long-term focus; zero-commission trading,Strong brand trust; scale; diversified offerings,Limited global retail presence vs peers,Digital engagement; regulatory complexity,Vanguard; BlackRock; Charles Schwab; T. Rowe Price,12% US retail assets,B2C & B2B Advisory,Low,NA,Top-tier peer,Continued AUM growth,Digital investing; retirement solutions,ICI; SIFMA,Client retirement success stories,Direct & advisor-led,AI personalization; crypto services,ETF & digital asset expansion,$500B+,$300B,$100B,Generous,Mental health support,Predictable,Limited,Yes,Yes,Yes,Strong,"High (technology, digital, customer service roles)",8%,9–11 years,Strong D&I focus,Collaborative,Strong,High,Open,Inclusive,High ethics,Medium,Low,Strong,Resilient,Stable,$28B,$7B (est.),AssetManagement;Brokerage;Retirement,$250B+ (est.),7–9%,Highly profitable,Johnson family,NA,NA,Medium,Very High,4.50%,<5%,50,NA,NA,NA,Hybrid,40–45 hrs,Occasional,Rare,Hybrid,Central,Office dependent,Limited,45 mins,Business district,High,Strict,High,High,Abigail Johnson,https://www.linkedin.com/iNAbigail-johnson/,Ned Johnson IV; Kathleen Murphy; Michael Durbin,Alumni; advisors; industry forums,Medium,NA,NA,NA,NA,Private board,High,Strong,Strong,High,High,Strong,Clear,Excellent,High,High,Balanced,High,High,Mature,Very High,Premium,Rare,Very High,Strong brand,Very strong,High,Clear,AWS; Google Cloud; Salesforce,Proprietary trading & analytics platforms,$2B+,Advanced,Python; Java; React; AWS,Strong,Fintech; data providers,Very High
