company_id,name,short_name,logo_url,category,incorporation_year,overview_text,nature_of_company,headquarters_address,operating_countries,office_count,office_locations,employee_size,vision_statement,mission_statement,core_values,history_timeline,recent_news,website_url,linkedin_url,twitter_handle,facebook_url,instagram_url,primary_contact_email,primary_phone_number,regulatory_status,legal_issues,esg_ratings,supply_chain_dependencies,geopolitical_risks,macro_risks,carbon_footprint,ethical_sourcing,marketing_video_url,customer_testimonials,website_quality,website_rating,website_traffic_rank,social_media_followers,glassdoor_rating,indeed_rating,google_rating,awards_recognitions,brand_sentiment_score,event_participation,pain_points_addressed,focus_sectors,offerings_description,top_customers,core_value_proposition,unique_differentiators,competitive_advantages,weaknesses_gaps,key_challenges_needs,key_competitors,market_share_percentage,sales_motion,customer_concentration_risk,exit_strategy_history,benchmark_vs_peers,future_projections,strategic_priorities,industry_associations,case_studies,go_to_market_strategy,innovation_roadmap,product_pipeline,tam,sam,som,leave_policy,health_support,fixed_vs_variable_pay,bonus_predictability,esops_incentives,family_health_insurance,relocation_support,lifestyle_benefits,hiring_velocity,employee_turnover,avg_retention_tenure,diversity_metrics,work_culture_summary,manager_quality,psychological_safety,feedback_culture,diversity_inclusion_score,ethical_standards,burnout_risk,layoff_history,mission_clarity,sustainability_csr,crisis_behavior,annual_revenue,annual_profit,revenue_mix,valuation,yoy_growth_rate,profitability_status,key_investors,recent_funding_rounds,total_capital_raised,customer_acquisition_cost,customer_lifetime_value,cac_ltv_ratio,churn_rate,net_promoter_score,burn_rate,runway_months,burn_multiplier,remote_policy_details,typical_hours,overtime_expectations,weekend_work,flexibility_level,location_centrality,public_transport_access,cab_policy,airport_commute_time,office_zone_type,area_safety,safety_policies,infrastructure_safety,emergency_preparedness,ceo_name,ceo_linkedin_url,key_leaders,warm_intro_pathways,decision_maker_access,contact_person_name,contact_person_title,contact_person_email,contact_person_phone,board_members,training_spend,onboarding_quality,learning_culture,exposure_quality,mentorship_availability,internal_mobility,promotion_clarity,tools_access,role_clarity,early_ownership,work_impact,execution_thinking_balance,automation_level,cross_functional_exposure,company_maturity,brand_value,client_quality,exit_opportunities,skill_relevance,external_recognition,network_strength,global_exposure,technology_partners,intellectual_property,r_and_d_investment,ai_ml_adoption_level,tech_stack,cybersecurity_posture,partnership_ecosystem,tech_adoption_rating
2,Fractal Analytics Private Limited,Fractal,https://fractal.ai/wp-content/uploads/2022/05/fractal-logo.svg,Enterprise,2000,"Fractal is a global AI and advanced analytics company that helps Fortune 500 and large enterprises leverage data, machine learning, and digital solutions to drive business transformation, customer engagement, and operational efficiency.",Private,"Mumbai, Maharashtra, India",India; United States; United Kingdom; Hong Kong; Australia; Canada,10+,"Mumbai, India; Bangalore, India; New York, United States; San Francisco, United States; London, United Kingdom; Sydney, Australia; Toronto, Canada","4,000 employees",To power every human decision in the enterprise through AI and analytics.,"Help the world’s most admired companies use AI and data to drive ethical, sustainable, and scalable business growth.",Client success; Innovation; Integrity; Collaboration; Continuous learning,One of India’s earliest AI-first companies; Majority investment by TPG in 2022,"2023,Launched healthcare AI platform for pharma analytics; 2024,Expanded partnerships with global cloud providers",https://fractal.ai,https://www.linkedin.com/company/fractal-analytics,@fractalai,https://www.facebook.com/FractalAI,https://www.instagram.com/fractal.ai,info@fractal.ai,NA,ISO 27001; GDPR Compliance; SOC 2,No major public legal controversies reported,Diversity hiring initiatives; Digital-first delivery; Sustainability reporting,Cloud providers; Data vendors; Talent workforce,Data localization laws; Cross-border data transfer regulations,Enterprise IT budget tightening; Global economic slowdown,"Low to moderate,primarily digital and cloud-based operations",Vendor code of conduct; ESG screening,https://www.youtube.com/@FractalAI,Global CPG analytics success story; Fortune 100 bank AI transformation,"Modern, enterprise-focused, strong AI thought leadership, clear industry positioning",8.5/10,Global 150K; US 60K,350000,4.0/5,4.1/5,4.3/5,Great Place to Work Certified; Forbes AI 50 Asia; Analytics India Awards,"Positive,strong enterprise trust and AI expertise perception",World AI Summit; AWS re:Invent; Gartner Data & Analytics Summit,Low ROI from data initiatives; Lack of AI talent; Siloed data systems; Poor customer personalization; Slow decision-making; Model deployment complexity,Financials; Consumer Discretionary; Health Care; Industrials; Information Technology; Retail,AI and Analytics Consulting; Data Engineering Services; Machine Learning Platforms; CPG and Retail AI Solutions; Healthcare Analytics; Marketing Analytics,Fortune 500 CPG Companies; Global Banks; Retail Chains; Pharmaceutical Companies; Insurance Providers; Technology Enterprises,End-to-end AI lifecycle delivery; Deep domain expertise; Scalable global delivery model; Proprietary AI platforms; Strong ROI focus,Strong CPG and healthcare analytics depth; Proprietary AI platforms; Global delivery with local consulting presence; High client retention,Deep domain models; Long-term enterprise relationships; Scalable AI talent pool; Strong global partnerships,Lower global brand visibility than Big Four; Heavy dependence on large enterprise clients; Limited productized SaaS offerings,Scaling AI governance; Competing with global consultancies; Talent retention in AI roles; Expanding SaaS portfolio,Accenture Applied Intelligence; Deloitte Analytics; TCS Analytics; Infosys AI; Mu Sigma; ZS Associates; Genpact; Cognizant,3–4% of global enterprise AI services,Enterprise Field Sales,"Yes,Top 10 clients ~35% revenue",Potential IPO; Strategic acquisition opportunities,Stronger AI depth than Genpact; Comparable analytics scale to Mu Sigma; Higher healthcare focus than TCS Analytics,Revenue projected $500M by 2027,Global expansion; SaaS AI platforms; Healthcare analytics growth; GenAI solutions,NASSCOM; Analytics India Magazine; World Economic Forum AI groups,Fortune 50 CPG demand forecasting; Global bank AI-driven risk analytics,Enterprise account teams; Industry-focused consulting; Cloud partner co-selling,Generative AI platforms; Vertical SaaS analytics; MLOps automation,AI copilots; Healthcare analytics suite; Marketing optimization tools,$300B global enterprise AI and analytics services,$80B enterprise AI services,4%,Paid leave; Mental health days; Annual PTO,Health insurance; Mental wellness; OPD,Mostly fixed,Moderate,Employee stock options; Performance bonuses,Dependents covered; OPD,Housing; Travel reimbursement,Wellness programs; Meals; Fitness,Data Science ~120 open roles; Engineering ~80 open roles; Consulting ~60 open roles; Sales/BD ~25 open roles,14% annually,4 years,35% women workforce; Global DEI programs,Collaborative; Performance-driven,Strong coaching focus,High,Continuous feedback; Quarterly reviews,Gender equity programs; Inclusive leadership,High integrity; Compliance-driven,Moderate,No major layoffs reported,High,Digital inclusion; ESG initiatives,Transparent and compliance-driven,$300–350M ,$26M,Consulting&Services 80%;Platforms&IP 20%,$1.5B (estimated post-TPG investment),20%,Profitable,TPG Capital; Khaitan Holdings,"Growth Equity,$360M,2022,TPG Capital",$400M,$50K per enterprise ,~$1M+,83.40%,<5%,55,~$4M/month ,36 months,~1.2x,"Hybrid, 50% flexible",Flexible,Occasional during project peaks,Rare,Remote; Hybrid,Central business districts,Metro; Bus,Ride-hailing; Company transport,45 minutes,IT hub,Secure; Well-lit,Late-night transport; Workplace safety,Fire compliant; Secure access,Medical support; Fire drills,Srikanth Velamakanni,https://www.linkedin.com/in/srikanthvelamakanni,"Srikanth Velamakanni,Co-founder & CEO; Pranay Agrawal,Co-founder & CEO; Shashank Dubey,Global Head Marketing",TPG Capital network; Fortune 500 client executives; Global AI leadership forums,"Medium,enterprise sales model with leadership access via partnerships and senior BD teams",Pranay Agrawal,CEO,somya.agarwal@fractal.ai.,(022) 40675800,Srikanth Velamakanni; TPG Partner Representatives; Independent Directors,"$1,200 per employee/year",Strong,Internal LMS; Certifications; AI bootcamps,High,Leadership mentors; Peer mentors,Medium,Merit-based; Transparent,Cloud platforms; AI frameworks; DevOps tools,High,High,Client-facing; Revenue-linked,Balanced,High,Consulting; Engineering; Sales,Scale-up,Strong in AI and analytics,Fortune 500; Global enterprises,Big Tech; Global consultancies; AI startups,Very High,Strong AI and analytics credibility,Strong alumni network; VC ecosystem,Global clients; International teams,AWS; Microsoft Azure; Google Cloud; Snowflake; Databricks,Proprietary AI platforms; Industry-specific ML models; Analytics accelerators,10% of revenue,"High,enterprise AI platforms, MLOps pipelines, automated decision systems",AWS; Azure; Google Cloud; Python; TensorFlow; Snowflake; Databricks,ISO 27001; SOC 2; Regular penetration testing,AWS; Microsoft; Google Cloud; Snowflake; Databricks,"High,AI Leader; Above average enterprise maturity"
8,KALVI CAREER EDUCATION PRIVATE LIMITED,Kalvium,https://kalvium.com/wp-content/uploads/2025/12/Kalvium-Logo-SVG-scaled-1-1024x217.png;https://kalvium.com/wp-content/uploads/2023/06/Kalvium-Logo.png;https://kalvium.com/wp-content/uploads/2023/06/Kalvium-Logo-1.png,Startup ,2021,"Kalvium is an innovative EdTech company offering a 4-year work-integrated B.Tech in Computer Science & Engineering (CSE) through partnerships with UGC/AICTE-approved universities across India. The program emphasizes real-world software engineering practices, paid internships from year 2, open-source contributions, industry mentorship, and professional skill-building to prepare students for high-demand tech careers, positioning itself as a practical alternative to traditional engineering education.",Private,"Kalvium, 403, 22nd Cross Rd, Parangi Palaya, Sector 2, HSR Layout, Bangalore, Karnataka 560102, India",India,3+,"Bangalore, India; Salem, India;Chennai, India",150,"To transform higher education into relevant, engaging, and real-world focused learning experiences",To deliver India's most industry-relevant B.Tech CSE program that prepares students for global tech roles from day one,Innovation; Discipline; Ownership; Collaboration; Student-first; Practical excellence,"Curriculum designed by alumni from Ola, Microsoft, Google; Paid internships from second year; Strong emphasis on open-source contributions",Jan 2026 – Published blog on hands-on learning impact; 2025 – Entered partnership with NASSCOM Future Forge; Students won awards at Smart India Hackathon 2025,https://kalvium.com/,https://in.linkedin.com/school/kalvium,@kalvium,https://www.facebook.com/kalvium,https://www.instagram.com/kalvium,admissions@kalvium.com,+91 9483 200 300,UGC/AICTE compliant through university partners,None,Student impact focus; Ethical edtech,University partners; Tech mentors,India edtech regulations,Education policy changes; Intense EdTech competition,Low digital,Transparent partnerships,https://www.youtube.com/@kalvium,Best practical B.Tech experience; Paid internships changed my career; Mixed internal feedback,"Modern, student-centric, clear program information, good UX",8.5/10,"Global:450,000; India:45,000",120000,4.1/5,4.0/5,4.5/5,NASSCOM partnership; Student wins at Smart India Hackathon,Positive for program innovation; Mixed on internal work culture,NASSCOM Future Forge; Smart India Hackathon,Outdated theoretical engineering education; Lack of industry-relevant skills; No early practical exposure; Poor job placement outcomes; High education cost without ROI,Education; EdTech; Higher Education (Computer Science & Engineering),4-year B.Tech CSE program; Work-integrated learning model; Paid internships from year 2; Open-source project contributions; Industry mentorship; Professional skill development; University partnerships,Individual students & fresh applicants; Partner universities (Alliance University; Chitkara University; SRM University AP; JECRC University; Kalasalingam Academy; others),Real-world software engineering education; Paid internships early in program; Open-source portfolio building; Industry-aligned curriculum; Better career readiness and outcomes than traditional colleges,Work-integrated education from year 1; Paid internships in year 2; Real company workflows in classroom; Strong focus on open-source contributions,Strong university partnerships; Curriculum designed by industry veterans; Early paid experience; Founder expertise from Ola/Microsoft/Google,Limited national brand recognition; Reliance on partner universities; Relatively new entrant; Regional admissions focus,Regulatory approvals for expansion; Scaling partnerships; Competing with established colleges; Maintaining quality during rapid growth,Scaler Academy; Newton School; Masai School; UpGrad; Simplilearn; Great Learning; AlmaBetter; Traditional B.Tech colleges,3% of Indian CS edtech segment,Direct admissions (online applications + counseling),Yes universities >20%,Potential IPO in 6–8 years; Strategic acquisition by global edtech,Stronger industry integration than traditional colleges; Similar work-focus to Scaler/Newton,?50 Cr 2027,Expand university network; Enhance program features; Scale student intake,NASSCOM,Student achievements in hackathons; Early internships at tech companies,University partnerships; Outcome-based pricing; Campus marketing,Enhance work-integrated features; Add AI-driven learning tools,10+ CSE specializations,"?10,000 Cr CS undergrad India","?1,000 Cr private unis",INR 5.4B,Standard Indian startup,Group health insurance; Mental health counseling,90% fixed 10% variable,Performance-based,Employee stock options; Long-term incentives,Yes dependents,Partial relocation allowance,Meals; gym; wellness,Sales & Admissions; Academic Mentors & Trainers; Software Engineering; Growth & Marketing; Operations,20%,2.1 years,Young diverse est. 30% women,Rigorous; Professional; Ownership-focused; Mixed reviews on pressure,Coaching-oriented with strong academic leadership,High,Continuous agile,Inclusive young teams,High mission-driven,Medium growth,No major layoffs reported,High,Education access programs; Digital-first delivery,Resilient growth,?5.7 Cr ,?1 Cr est.,80% tuition recurring; 20% services,?100 Cr ,100%,Profitable est.,Rainmatter Capital; Zerodha Nithin Kamath; Kunal Shah Cred; Anupam Mittal,Seed round – Dec 2021 – $1.7M,?12.76 Cr,?50k est. student,?5L,41.70%,12%,70,?50L/month est.,24 months,2x est.,Hybrid (office-centric for most roles),Flexible 9–10 hour workdays,Occasional growth phase,Rare,Hybrid flexible,"Central (HSR Layout, Bangalore)",Metro connectivity; Bus routes,Uber abundant; No cab,1 hour (Bangalore airport),IT hub HSR Layout,Safe in daytime; Moderately safe at night,Late-night cab policy; Women safety measures,Modern co-working,Basic startup,Rajesh Kumar,https://in.linkedin.com/in/rajeshkumarb,Rajesh Kumar – Cofounder & CEO; Anil Gulecha – Cofounder & CTO; Venkataraghulan V – Cofounder,Zerodha alumni; Edtech founders; IIT networks,Medium ,Rajesh Kumar,Co-Founder & CEO,raghuram@kalvium.com,NA,Founders; Investor reps,High edtech focus,Structured onboarding with technical bootcamps,Continuous upskilling,High real projects,Industry mentors,High small team,Merit fast-track,Modern MERN AI,High mission-driven,High startup,Direct student outcomes,Balanced innovation,High AI tools,Full edtech stack,Scale-up,Growing recognition in edtech,Top private universities; Tech leaders,Product companies; Edtech firms; Academia,High edtech tech,Growing,Strong investor alumni,International curriculum benchmarks,NASSCOM; Partner universities (Alliance; Chitkara; SRM AP; JECRC; Kalasalingam; others),Quadrangle AI platform,15% revenue est.,High - Quadrangle learning AI,AWS; React; Node.js; Python; PostgreSQL; GitHub; Zoom; Moodle,Standard startup; No breaches,Alliance University; Chitkara University; SRM University AP; JECRC University; Kalasalingam Academy; others,Advanced AI learning; Leader edtech
12,Cloudera Data Platform India Private Limited,Cloudera India,https://www.cloudera.com/etc.clientlibs/cloudera/clientlibs/clientlib-site/resources/img/cloudera-logo.svg; https://pbs.twimg.com/profile_images/1886852495680397312/uBP7w7l2.png,Private Ltd Company ,2012,"Cloudera India is the Indian subsidiary of Cloudera Inc., delivering the Cloudera Data Platform (enterprise hybrid data cloud) with strong focus on regulated industries such as BFSI, telecom, and government.",Private Subsidiary ,"3rd Floor, Essae Vaishnavi Summit, Koramangala, Bangalore, Karnataka, India",India; United States; China; Australia; United Arab Emirates,4,"Bangalore, India; Chennai, India; Mumbai, India; Delhi, India; Beijing, china",650–800 ,"Make enterprise data useful, secure and accessible anywhere",Empower organizations to turn complex data challenges into business breakthroughs with an open hybrid data platform,Customer Focus; Integrity; Innovation; Collaboration; Inclusion; Execution,Powers major Indian banks and exchanges; early mover in sovereign AI use cases,Expanded AI CoE in Bangalore; NVIDIA sovereign AI partnership; GenAI BFSI wins,https://www.cloudera.com/,https://www.linkedin.com/company/cloudera/,@cloudera,https://www.facebook.com/cloudera,https://www.instagram.com/cloudera/,india@cloudera.com; sales@cloudera.com,+91 80 6149 3000,SOC2 Type II; ISO 27001; GDPR; HIPAA; FedRAMP; RBI alignment; DPDP readiness,None material,Carbon awareness; ESG data use cases,Open-source; hyperscalers; hardware partners,Data localization; sovereignty rules,Talent costs; hyperscaler competition; regulation,Low direct footprint,Open-source governance; ethical AI,https://www.youtube.com/@Cloudera,YES Bank; Vodafone Idea; BSE,Professional; enterprise-grade; solution-focused,8.5/10,Global:90k–130k; India:10k–18k,400000,4.0/5,NA,4.7/5,Forrester Wave Leader; IDC MarketScape Leader; NVIDIA partner awards,Positive (7.8/10),Strata Data & AI; AWS re:Invent; NVIDIA GTC; India BFSI summits,Hybrid data governance; regulatory compliance; cost control; legacy Hadoop modernization; GenAI workloads at scale,BFSI; Telecom; Government & PSU; Retail; Manufacturing; Healthcare; Energy; Media,Cloudera Data Platform; DataFlow; Machine Learning; Operational DB; SDX; Hybrid Data Cloud,YES Bank; HDFC Life; ICICI Lombard; Axis Bank; Vodafone Idea; Bharti Airtel; BSE; Reliance; PhonePe; ONGC,Single hybrid platform across on-prem/cloud/edge with enterprise-grade security and governance,True hybrid multi-cloud; native Apache Iceberg lakehouse; strong regulated-industry footprint in India,Petabyte-scale Indian references; open standards; compliance leadership; data sovereignty readiness,Perceived complexity; higher cost vs pure cloud-native; slower GenAI feature rollout,Faster GenAI adoption; DPDP Act readiness; hyperscaler competition; talent retention,Databricks; Snowflake; AWS; Azure Synapse; Google BigQuery; Dremio; Starburst; IBM watsonx.data,8–12% ,Field sales + partner-led,Low,Parent taken private 2021,Slower growth than Databricks; stronger regulated penetration,18–25% CAGR,GenAI; sovereign AI; lakehouse adoption; public sector,Apache Foundation; NASSCOM; Open Lakehouse,YES Bank; Vodafone Idea; BSE; Reliance; PhonePe,Partner-led + enterprise sales,GenAI studio; RAG; unified governance; streaming-AI,Private AI; vector DB; metadata automation; DPDP tools,$8–12 Bn,$2.5–4 Bn,$2B–$5B,Generous PTO; parental; sick leave,Group insurance; wellness programs,75–85% fixed,Moderate-high,RSUs for senior roles,Yes,Yes,Meals; cab; gym; wellness allowance,"15–30 open roles (Engineering, Sales, Solutions, Professional Services)",13–17% ,2.5–3.5 years,35–40% women; active DEI programs,Collaborative; enterprise-focused,Good,Moderate-high,Structured reviews,Active programs,High,Moderate,Minimal,Clear,Moderate,Stable & professional,?450–650 Cr ,Profitable ,Subscription&support(80–85%);services&training(15–20%),$4.5–5.5B,12–20% ,Profitable,KKR; Clayton Dubilier & Rice,None post-2021,NA,?35–60 lakh (est.),?3–8 Cr+,1:8 to 1:15,4–8%,60–75,Zero (profitable),Infinite,Profitable,Hybrid (3 office / 2 remote),Flexible core hours,Occasional,Rare,Hybrid,Central ,Metro; buses; cabs,Excellent,50–90 minutes,Prime IT hub,Safe,Late-night transport; CCTV; security desk,Modern; fire-safe,First aid; hospital tie-ups,Charles Sansbury,https://www.linkedin.com/in/charles-sansbury/,"Mayank Baid,RVP India; Abhas Ricky,CSO; Amy Nelson,CPO",SI partners; alumni network; PE/investor network,Medium,Mayank Baid,"Regional Vice President,India & South Asia",mayank.baid@cloudera.com,NA,Aine Kett; Raju Inbaraju; Stephen Bernard,Moderate–high,Structured,Certifications; internal academy,High-impact enterprise projects,Senior engineers and managers,Moderate-good,Merit-based,Modern cloud and AI stack,High,Moderate-high,Customer-facing; revenue-linked,Balanced,High,Engineering; Sales; Product; Partners,Mature subsidiary,Strong enterprise brand,"Top-tier BFSI, telecom, government",Google; Amazon; Microsoft; PhonePe; Flipkart,Very high,Strong,Alumni + partner ecosystem,Moderate-high,AWS; Azure; Google Cloud; NVIDIA; Dell; Intel; Red Hat; Accenture; Deloitte; TCS; Infosys; Wipro; PwC,"Distributed systems, security, governance patents",High (10–15% of revenue at parent),Very high,Hadoop; Spark; Iceberg; Kafka; NiFi; Ozone; Kubernetes; Impala; HBase; Ranger; Atlas,SOC2; encryption; RBAC; zero-trust elements,TCS; Infosys; Wipro; Accenture; Deloitte; AWS; Azure; Google; NVIDIA,Leading in hybrid lakehouse
