66,Tredence Inc.,Tredence,https://www.tredence.com/wp-content/uploads/2022/09/tredence-logo.svg,Scale-up,2013,"Global data science and AI engineering company delivering analytics, machine learning, and business intelligence solutions for enterprise transformation",Private,"Illinois, United States",United States; India; United Kingdom; Hong Kong; Canada,7,"Chicago,United States;Bangalore,India;Chennai,India;Pune,India;Hyderabad,India;London,United Kingdom;Toronto,Canada;Hong Kong,Hong Kong",3000,To be the world’s most trusted data science and AI engineering company,Empower enterprises to unlock the full value of their data using AI and analytics,Innovation; Integrity; Customer-first; Excellence; Collaboration,Recognized in Gartner Magic Quadrant; Works with 50+ Fortune 500 firms,$175M growth funding by Advent International (2023); Expansion into Europe (2024),https://www.tredence.com,https://www.linkedin.com/company/tredence-inc,@TredenceInc,https://www.facebook.com/Tredence,https://www.instagram.com/tredenceinc,info@tredence.com,1 650 460 4090,ISO 27001; SOC2; GDPR compliant,No,ESG analytics; carbon optimization projects; DEI initiatives,Cloud providers; Data platform vendors,Data sovereignty laws; cross-border regulations,Economic slowdown; IT budget cuts,Medium; carbon optimization programs,Vendor ESG audits; compliance screening,https://www.youtube.com/@Tredence,Walmart AI transformation; PepsiCo analytics modernization,"Professional, enterprise-focused, high UX clarity",4.6 / 10,24000,185000,4.1/5,4.0/5,4.5/5,Gartner MQ Leader; Great Place to Work; Inc 5000,Very Positive,Gartner Data Summit; AWS re:Invent; NASSCOM Analytics Summit,Data silos; Poor analytics adoption; Low AI ROI; Complex data engineering; Business decision latency,Retail; CPG; BFSI; Healthcare; Manufacturing; Telecom,Data engineering; AI & ML solutions; Cloud analytics; Business intelligence; Decision science,Walmart; PepsiCo; Target; Walgreens; United Airlines; Cisco; Best Buy; Starbucks,AI-driven business transformation; Faster analytics insights; Scalable data platforms; High ROI,Retail-focused analytics expertise; Proprietary accelerators; Rapid AI deployment; Business-first AI,Deep domain models; Strong Fortune 500 relationships; Proprietary AI frameworks,High dependency on large enterprise clients; Premium pricing,Scaling AI automation; Talent retention; Global regulatory compliance,Mu Sigma; Fractal Analytics; Tiger Analytics; LatentView; ZS Associates; EXL Analytics,6% global enterprise analytics services,Enterprise field sales,No ,IPO planned 2027–28,Higher domain depth; faster AI deployment; stronger enterprise focus,$500M ARR by 2028,Global expansion; AI automation; Industry platforms,NASSCOM; CII; Data Science Alliance,Walmart supply chain AI; PepsiCo analytics modernization,Enterprise sales; CXO targeting; Industry vertical focus,GenAI platforms; Autonomous decision engines; Real-time analytics,GenAI copilots; Autonomous BI; AI-powered forecasting,$120B,$35B,$1.8B,Flexible leave; Mental health days,Insurance; OPD; Mental health programs,85% fixed,Medium-high,Stock options; Long-term incentive plans,Parents; Spouse; Children,Moving allowance; Housing assistance,Meals; Gym; Wellness; Cab,High ,16%,3.1 years,35% women; global DEI programs,Collaborative; Fast-paced; Performance-driven,High,High,Continuous feedback; Quarterly reviews,Gender diversity; Inclusive hiring; Leadership programs,High,Moderate,NA,Very clear,ESG programs; Carbon reduction; Social impact,Employee-first; Transparent,$250M (FY25 estimated),$35M,Recurring:70%;Services:30%,$1.2B ,38%,Profitable,Advent International; Accel Partners,"Growth Equity,$175M ",$200M,12000,350000,0.10%,500%,72,$1.5M,36+ months,0.9,Hybrid,9–10 hours,Occasional,Rare,Hybrid; Flexible work hours,Central IT corridor,Metro; Bus; Corporate shuttles,Company-sponsored cabs; Uber partnerships,45 mins,IT Park,High,Night cabs; GPS tracking; Women safety policies,Fire systems; CCTV; Access controls,Fire drills; Medical support,Shub Bhowmick,https://www.linkedin.com/in/shubbhowmick,Shub Bhowmick; Sumit Mehra; Raghav Parthasarathy,Advent International network; IIT alumni; Retail CXO network,Medium,Enterprise Sales Desk,Senior Sales Manager,sales@tredence.com,NA,Shub Bhowmick; Advent Board Nominees; Industry veterans,1200,Structured ,Certifications; Internal AI academy,high,Senior mentors; Buddy programs,Strong,Merit-based; Transparent,Enterprise-grade AI & analytics stack,Very high,High,Revenue; Product; Client,Balanced,Very high,Product; Consulting; Engineering,Mature scale-up,strong ,Fortune 500; Global MNCs,Big Tech; Global consulting; AI startups,Extremely high,Strong,Very strong global alumni network,US & EU clients; Global teams,AWS; Microsoft Azure; Google Cloud; Snowflake; Databricks,AI accelerators; Retail ML frameworks; Data automation engines,0.18,Very High ,AWS; Azure; GCP; Python; Spark; Snowflake; Databricks; Power BI,SOC2; ISO 27001; Zero-trust architecture,AWS; Microsoft; Google; Snowflake; Databricks,Advanced; Industry leader
73,HyperVerge Technologies Private Limited,HyperVerge,https://hyperverge.co/wp-content/uploads/2023/06/hyperverge-logo.png; https://pbs.twimg.com/profile_images/1056066836473806848/s6O-MrmT.jpg; https://www.linkedin.com/company/hyperverge/image,Startup,2014,"HyperVerge is an AI company specializing in computer vision and identity verification solutions for BFSI, fintech, telecom, and government sectors globally.",Private ,"Bangalore, Karnataka, India",India; United States; United Kingdom,2,"Bangalore, India; Chennai, India; Palo Alto, United States",200–300,A future where identity and trust are seamless and digital,Help people and businesses interact with confidence using AI,Integrity; Excellence; Curiosity; Impact,Processes 500M+ identities; IIT Madras roots,Expansion in Southeast Asia; Continued BFSI adoption,https://hyperverge.co,https://www.linkedin.com/company/hyperverge,@hyperverge,NA,NA,contact@hyperverge.co,+91 80 4709 1350,ISO 27001; SOC2 Type II; GDPR,NA,Ethical AI use; Paperless operations,Cloud infrastructure; OEM integrations,Data localization and cross-border compliance,Regulatory tightening; AI competition,Low,Responsible AI and vendor selection,https://www.youtube.com/@hyperverge,Trusted by leading banks and fintechs,Professional; Enterprise-focused; Clear messaging,8.5/10,Global 300k; India 40k,40000,4.2/5,4.1/5,NA,Recognized leader in APAC digital identity,Positive,Fintech conferences; AI summits,Fraudulent onboarding; Manual KYC delays; Low verification accuracy,BFSI; Fintech; Telecom; Government,Face recognition; Liveness detection; ID document verification,Banks; Fintechs; Telecom operators; Government agencies,High accuracy AI; Fast onboarding; Low fraud rates,High accuracy on diverse faces; Low-bandwidth optimization,Proprietary CV models; Large-scale deployment experience,Long enterprise sales cycles; BFSI dependence,Global regulatory complexity; Competitive IDV market,Jumio; Onfido; IDnow; Signzy,Leader in India eKYC,Enterprise B2B,No,Acquisition or IPO,Higher accuracy in low-light and diverse demographics,$40M+ ARR by 2027,Global expansion; Product depth; BFSI dominance,Fintech and AI industry forums,Digital onboarding for 100M+ users,Enterprise direct sales; Partnerships,Fraud analytics; Document automation,Insurance fraud detection; AML automation,15–18B,3–4B,150–200M,Flexible,Insurance; Mental health support,Mostly fixed,Medium,ESOPs offered,Dependents covered,Available for key roles,Meals; Wellness programs,AI Engineers (20); Backend Engineers (15); Product Managers (6); Sales & Partnerships (8),15%,24–30 months,Improving gender diversity,Ownership-driven; Fast-paced,High,High,Continuous,Improving,Transparent; Fair,Moderate,NA,Clear,Ethical AI; Digital inclusion,Transparent,15–20M,Near break-even,Licensing  50%; Products & services 50%,250M,40–50%,Near break-even,Accel; NEA; IVP,$51M,$51M,$15k,$150k,4.90%,<5%,50,Low to moderate,24+ months,1.2,Hybrid,Flexible,Occasional,Rare,Remote; Hybrid,Tech hub,Metro; Bus,Reimbursements available,45 minutes,Tech hub,Safe; Well-lit,POSH; Late-night cab,Fire compliant,Fire drills; First aid,Kedar Kulkarni,https://www.linkedin.com/in/kedarkulkarni,Kedar Kulkarni; Vignesh Krishnakumar,Accel network; NEA portfolio; IIT Madras alumni,Medium,Kedar Kulkarni,CEO,NA,NA,Accel and NEA appointed board,"$1,000 per employee",Strong,On-the-job learning; AI academy,High impact,Founders; Senior engineers,Moderate,Merit-based,Modern cloud stack,Clear,High,Customer-facing; Revenue-linked,Balanced,High,Product; Sales; Engineering,Scale-up,Strong in APAC,Tier-1 banks and fintechs,Big tech; Fintech unicorns,High ,Recognized in VC circles,Strong fintech & VC network,Asia; US; Europe,AWS; Cloud service providers; System integrators,Proprietary facial recognition and liveness detection models,High,Advanced,Python; TensorFlow; PyTorch; AWS; Kubernetes,Enterprise-grade; Regular audits,Banks; Fintechs; System integrators,High
74,Motorq Technologies Private Limited,Motorq,https://motorq.com/logo.png; https://www.linkedin.com/company/gomotorq/logo; https://motorq.com/favicon.ico,Startup,2017,"Motorq is an enterprise platform for Connected Vehicle Intelligence, converting cloud-connected vehicle data into actionable insights through direct OEM integrations without hardware dongles.",Private ,"345 California St, Suite 600, San Francisco, CA 94104, USA",United States; India; United Kingdom,8,"San Francisco, United States; Bangalore, India; London, United Kingdom; Tokyo, Japan",128,Enable a data-driven future for every vehicle,Build the data infrastructure layer for mobility,Innovation; Data integrity; Customer focus,Founded by ex-Amazon leaders; Hardware-free telematics approach,Series B funding announced 2023; OEM partnership expansion 2024,https://motorq.com,https://www.linkedin.com/company/gomotorq,@motorq_io,NA,NA,info@motorq.com,(415) 779-0525,GDPR compliant; SOC2 aligned,NA,EV enablement; Low-carbon software,OEM APIs,Data localization regulations,EV adoption slowdown,Low,Responsible vendor selection,https://www.youtube.com/@motorq,Fleet customers report faster insights,Clean; enterprise-focused; developer-friendly,8.7/10,Global 450k; US 180k,12000,4.3/5,4.2/5,NA,Strong niche reputation in mobility technology,Positive,AutoTech conferences; Fleet management summits,Fragmented OEM data; Hardware-based telematics costs; Slow fleet insights,Automotive; Fleet Management; Mobility SaaS,Connected vehicle APIs; Fleet analytics; EV data intelligence,Fleet operators; OEMs; Leasing companies,Hardware-free OEM data access; Faster insights; Lower integration cost,OEM-direct integrations; API-first platform,Proprietary data normalization layer; OEM partnerships,OEM dependency; Limited brand awareness,OEM policy changes; Enterprise sales cycles,Otonomo; Wejo; Geotab; Samsara,Early-stage,Enterprise B2B,No,Acquisition or IPO,Faster API onboarding; Smaller scale,$15M ARR by 2027,OEM expansion; EV analytics; Global growth,Mobility technology forums,Fleet electrification analytics,Direct sales; Partnerships; API evangelism,EV battery insights; Predictive maintenance,OEM diagnostics; Real-time alerts,20–25B,4–6B,200–300M,Flexible leave,Insurance; Mental health support,Mostly fixed,Medium,ESOPs offered,Dependents covered,Limited,Meals; Wellness programs,Backend Engineers (10); Data Engineers (6); Platform Engineers (4); Sales & Partnerships (3),6%,18–24 months,Improving gender mix,Engineering-led; Performance-driven,High,High,Continuous; OKR-based,Improving; Early-stage,Transparent; Fair,Moderate,NA,Clear,EV enablement,Transparent,7–8M,Loss-making,80% recurring; 20% services,200M,60%,Loss-making,Avicenne Capital; FM Capital; Story Ventures,$49M – 2023,$49M,$10k,$80k,4.70%,6%,45,$300k,18–24 months,1.6,Hybrid,Flexible,Occasional,Rare,Remote; Hybrid,Tech hub,Metro; Bus,Easy; Reimbursements,60 minutes,Tech hub,Safe; Well-lit,POSH; Late-night cab,Fire compliant,Fire drills; First aid,Arun Rajan,https://www.linkedin.com/in/arunrajan,Arun Rajan – CEO; Senior leaders from Amazon background,VC network; Auto-tech ecosystem,Medium,Arun Rajan,CEO,NA,NA,VC-appointed board; Industry advisors,"$1,000 per employee",Strong,On-the-job learning; Stipends,High impact,Founders; Senior engineers,Moderate,Merit-based,Modern cloud stack,Clear,High,Revenue-linked; Customer-facing,Balanced,High,Product; Sales; Engineering,Scale-up,Growing,Industry leaders,Auto-tech; SaaS,High,Good VC-backed,Auto-tech; VC network,US; India,AWS; Snowflake; OEM API providers,OEM data normalization IP,High,Moderate,AWS; Python; Go; Snowflake; Kubernetes,Enterprise-grade; No known breaches,OEMs; Fleet SaaS vendors,Above average; API-first
79,Darwinbox Digital Solutions Private Limited,Darwinbox,https://www.darwinbox.com/wp-content/uploads/2022/03/darwinbox-logo.svg,Startup SaaS,2015,"Darwinbox is a global HRMS SaaS company providing AI-powered human capital management solutions across recruitment, payroll, performance, engagement, and analytics.",Private,"Hyderabad, Telangana, India",India; United States;Indonesia; Philippines; Malaysia; Vietnam; United Arab Emirates,8,"New York,United States; Paris,France; Brussels,Belgium; London,United Kingdom; Dublin,Ireland; Tokyo,Japan",1200,To simplify work life globally,To build the world’s most loved HR platform,Customer obsession; Innovation; Ownership; Collaboration; Integrity,One of Asia’s fastest growing SaaS unicorns; Founded by former Microsoft leaders,Series D funding round in 2024; Middle East expansion in 2025,https://www.darwinbox.com,https://www.linkedin.com/company/darwinbox,darwinbox,https://www.facebook.com/darwinbox,https://www.instagram.com/darwinbox,sales@darwinbox.com,NA,GDPR compliant; ISO 27001 certified; SOC2 Type II,No ,Green hosting; DEI hiring programs; paperless HR workflows,Cloud vendors; payroll integration partners,Data localization regulations; labor law changes,Hiring slowdown; enterprise IT budget tightening,Low footprint through digital HR workflows,Vendor ESG audits; ethical recruitment policies,https://www.youtube.com/@darwinbox,Tata HR digital transformation case; Swiggy HR automation success,Professional; modern UX; strong enterprise messaging,NA,78000,320000,4.3/5,4.2 /5,4.5/5,Gartner Magic Quadrant Challenger; LinkedIn Top Startups India; Deloitte Technology Fast 50,Very Positive,HR Tech Conference; SaaStr; NASSCOM Product Conclave,Legacy HR inefficiencies; Payroll complexity; Poor employee experience; Talent retention; HR data fragmentation,Enterprise SaaS; HR Technology; Cloud Software; AI Analytics,Core HR; Payroll; Talent Management; Recruitment; Performance Management; People Analytics; Engagement Platform,Tata Group; Mahindra Group; Adani Group; Swiggy; Flipkart; Delhivery; TVS Motor; Myntra,Unified HR platform; AI-driven insights; Rapid deployment; Enterprise-grade configurability,Mobile-first HRMS; Deep localization; AI-driven insights; Rapid implementation,Strong enterprise adoption; Deep HR workflows; Regional dominance; High customer retention,Limited brand awareness in US; Complex enterprise customizations,Global expansion; Regional compliance; Pricing competitiveness,Workday; SAP SuccessFactors; Oracle HCM; Zoho People; Freshteam; Keka,35% in India enterprise HR SaaS,Enterprise Field Sales; Product-led growth,No,IPO candidate or strategic acquisition,Better UX than SAP; faster innovation than Oracle; stronger localization than Workday,$200 million  ARR by 2028,Global expansion; AI HR copilots; payroll automation,NASSCOM; SHRM; SaaSBOOMi,Tata HR digitization; Swiggy workforce automation,Enterprise sales; partner ecosystem; inbound SaaS,Generative AI HR copilots; workforce intelligence automation,Predictive hiring AI; autonomous payroll engine,$120 billion,35 billion $,2%,Flexible PTO; parental leave; mental wellness days,Premium insurance; mental wellness programs,85 % fixed; 15 % variable,Medium,Generous ESOP plans,Parents; spouse; children,Housing; travel reimbursement,Meals; gym; wellness allowance,Engineering 35 %; Sales 25%t; Customer Success 20%; Product 10 %; Operations 10%,12%,3.4 years,Women workforce 38 %; leadership diversity programs,Collaborative; ownership-driven; high growth,High,High,Continuous feedback; OKR-based reviews,Strong leadership commitment; inclusive hiring,Very high,Medium,No major layoffs,Very high,Education programs; green operations,Transparent; employee-first,$75 million,loss making,Subscription SaaS 92 %; Services 8%,$1.2 billion ,55%,"$10,000,000",Peak XV; Salesforce Ventures; Lightspeed; TCV,$75 million ,$190 million,"$7,500 ","$125,000 ",16.6 :1,4%,65,$1.5 million ,36 months,1.4,Hybrid with 65 % flexibility,Flexible 8-9 hours,Occasional,Rare,Hybrid; Remote,Central IT hubs,Metro; bus; cab,Corporate cab; reimbursement,45 minutes,IT park,High,Night cab; emergency helpline; women safety,Fire compliance; CCTV; access control,Fire drills; medical support,Jayant Paleti,https://www.linkedin.com/in/jayantpaleti,Rohith Reddy Co-founder; Chaitanya Peddi Co-founder; Anand Jain Chief Revenue Officer,Microsoft alumni network; Peak XV portfolio founders; SaaS ecosystem,Medium ,NA,NA,NA,NA,TCV partner; Salesforce Ventures board; Peak XV advisors,3.5 million $ annually,Excellent,Darwinbox Academy; certifications; mentoring,Very high,Formal mentoring; leadership coaching,High,Merit-based; transparent,AI tools; cloud labs,High,High,High enterprise impact,Balanced,Very high,Product; engineering; sales; customer success,Scale-up,High,Fortune 500; large enterprises,Global SaaS firms; unicorn startups,Very high,Strong,Strong VC and SaaS founder ecosystem,High,AWS; Google Cloud; Twilio; Razorpay; Microsoft,HR analytics engines; AI workflow models,28 % of revenue,Very High with predictive HR analytics and automation,AWS; Kubernetes; Python; React; PostgreSQL; Spark,ISO 27001; SOC2 Type II,Salesforce; AWS; Deloitte; KPMG; ADP,Industry Leader
80,Epifi Technologies Private Limited,EpiFi,https://epifi.com/assets/epifi-logo.svg,FinTech Startup,2020,"Epifi is a digital banking and financial services technology company offering savings, payments, cards, and wealth management through its consumer platform Fi Money in partnership with Federal Bank.",Private,"Bangalore, Karnataka, India",India,1,"Bangalore,India;",350,To simplify and humanize financial services for everyone,To build the smartest money platform for digital-first consumers,Customer obsession; Transparency; Innovation; Speed; Ownership,Founded by former Flipkart and Google leaders; One of India’s fastest growing neobanks,Expansion into credit products in 2024; AI-driven financial insights rollout in 2025,https://epifi.com,https://www.linkedin.com/company/epifi,epifi,https://www.facebook.com/epifi,https://www.instagram.com/epifi,support@epifi.com,NA,RBI compliance; PCI DSS; ISO 27001; GDPR readiness,No ,Paperless banking; financial inclusion programs; carbon-neutral hosting,Banking APIs; cloud hosting providers,Data localization laws; RBI regulatory changes,Economic slowdown; fintech funding cycles,Low footprint through digital-first operations,Vendor ESG audits; responsible lending principles,https://www.youtube.com/@epifi,High NPS reviews; digital banking adoption success,Modern; intuitive UX; mobile-first design,NA,135000,180000,4.4/5,4.3/5,4.5/ 5,LinkedIn Top Startups India; FinTech Innovation Award,Very Positive,Global Fintech Fest; NASSCOM Product Conclave; SaaSBOOMi,Poor digital banking experience; Fragmented financial products; Low financial transparency; Slow onboarding; Manual financial tracking,FinTech; Digital Banking; Consumer Finance; Payments; Wealth Technology,Fi Money digital bank; Savings accounts; Credit cards; Personal finance management; Investment tools; Payments,Urban salaried professionals; Freelancers; Young professionals; Startup employees; Digital natives,Seamless digital banking; Unified finance dashboard; Smart insights; Instant onboarding,Mobile-first banking; Smart financial insights; Superior UX; Rapid onboarding,Strong product design; AI-driven insights; Fast innovation cycles; Strategic banking partnerships,Dependence on partner bank; Limited physical banking access,Customer trust building; Regulatory compliance; Profitability scaling,Jupiter; Niyo; Paytm; PhonePe; RazorpayX; CRED,6% Indian neobanking,Product-led growth,No,IPO candidate or strategic acquisition,Better UX than Paytm; faster innovation than traditional banks; stronger insights than Jupiter,$150 million ARR by 2028,Credit expansion; wealth tech; AI financial advisory,NASSCOM; FICCI FinTech,Salary account adoption growth; SME banking onboarding,Mobile-first PLG; influencer marketing; digital partnerships,AI financial copilots; automated investment planning,Smart credit scoring; autonomous wealth management,450 billion $,90 billion $,3%,Flexible PTO; parental leave; mental wellness days,Premium insurance; mental wellness programs,85 % fixed; 15 % variable,Medium,Generous ESOP plans,Parents; spouse; children,Housing; travel reimbursement,Meals; gym; wellness allowance,Engineering 45%; Product 20%; Operations 15%; Sales 10%; Support 10%,14%,2.6 years,Women workforce 32 %; inclusive hiring programs,Collaborative; ownership-driven; fast-paced,High,High,Continuous feedback; OKR-based,Strong DEI initiatives,Very high,Medium,No major layoffs,Very high,Financial inclusion; green cloud,Transparent; employee-first,$35 million ,loss making,Banking commissions 60 %; Interchange fees 25 %; Subscription services 15%,$300 million ,85%,"$10,000,000",Accel; Peak XV; Ribbit Capital; Lightspeed,$50 million ,$125 million ,"$1,800 ","$38,000 ",87.60%,6%,67,$3 million ,30 months,1.8,Hybrid with 70 % flexibility,Flexible 8 to 9 hours,Occasional,Rare,Hybrid; Remote,Central IT hub,Metro; bus; cab,Corporate cab; reimbursement,45 minutes,IT park,High,Night cab; emergency helpline,Fire compliance; CCTV; access control,Fire drills; medical support,Ankit Gaur,https://www.linkedin.com/in/ankitgaur,Prabhudev Konana Co-founder and CTO; Vazeer Shamsi Co-founder and COO,Flipkart alumni network; Google alumni network; Accel portfolio,Medium,NA,NA,NA,NA,Accel partner; Ribbit Capital advisor; fintech veterans,2.2 million $ annually,Excellent,Internal learning platform; certifications,Very high,Formal mentoring; leadership coaching,High,Merit-based; transparent,AI tools; cloud labs,High,High,High consumer impact,Balanced,Very high,Product; engineering; operations; finance,Scale-up,High,High-quality retail banking customers,FinTech unicorns; big tech finance teams,Very high,Strong,Strong fintech and VC ecosystem,Medium,Federal Bank; AWS; Visa; Mastercard; Razorpay,AI financial insights engine; risk analytics models,35 % of revenue,Very High with predictive spending analytics and fraud detection,AWS; Kubernetes; Python; React; PostgreSQL; Spark,ISO 27001; PCI DSS; SOC2 roadmap,Federal Bank; Visa; Mastercard; AWS; Razorpay,Industry Leader
