94,Cleartrip,Cleartrip,https://commons.wikimedia.org/wiki/File:Cleartrip_Original.svg,Online Travel Platform,2006,"Cleartrip is an online travel booking platform offering flights, hotels, trains, and travel experiences with a focus on simplicity, transparency, and reliability.",Private Limited Company,"Mumbai, Maharashtra, India",India,5+,"Mumbai , India; Bangalore, India; Delhi, India; Dubai, United Arab Emirates",800+,Make travel simple and transparent for everyone,Deliver seamless and trustworthy travel booking experiences,"Simplicity, Transparency, Customer trust, Innovation",Founded in 2006; acquired by Flipkart Group in 2021; expanded train and experience bookings post acquisition,Product integration with Flipkart ecosystem and renewed brand positioning during 2024 and 2025,https://www.cleartrip.com,https://www.linkedin.com/company/cleartrip,@Cleartrip,https://www.facebook.com/cleartrip,https://www.instagram.com/cleartrip,support@cleartrip.com,NA,"Compliant with Indian IT, consumer protection, and data privacy regulations",No major public legal disputes,Limited public ESG disclosure; parent level ESG governance,Airline partners 45%; hotel aggregators 35%; rail APIs 20%,Cross border payment regulations,Travel demand cyclicality; fuel price volatility,Moderate due to digital platform operations,Partner compliance and vendor standards,https://www.youtube.com/watch?v=cleartrip-travel,https://www.cleartrip.com/reviews,"Clean UX, fast booking flow, mobile optimized",4.3/5,Global top 1000,"2,500,000+",3.8/5,3.9/5,4.4/5,Best Travel Booking App; UX Design Awards,Positive 65%,Travel Tech India; OTA Industry Events,"Complex travel booking, hidden fees, unreliable refunds",Travel and Tourism,Flights 55%; Hotels 30%; Trains and experiences 15%,Leisure travelers 70%; Business users 30%,Simple and transparent travel booking with reliable support,Clean UX and no clutter pricing,Strong brand recall; Flipkart ecosystem access,Smaller hotel inventory vs leaders,Scaling supply and loyalty programs,MakeMyTrip; EaseMyTrip; Yatra,8-12% Indian OTA market,Direct to consumer digital,Low,Acquired by Flipkart,Average,12-18% annual growth expected,Ecosystem synergies; loyalty integration,Internet and Mobile Association of India,Refund experience improvement,App first growth; Flipkart cross sell,Personalization and pricing intelligence,Loyalty and super app integrations,90 billion USD,30 billion USD,3-4 billion USD,Standard plus flexible leave,Medical insurance and wellness,85% fixed 15% variable,Medium,Available,Yes,Limited,Travel discounts up to 20%,Moderate,12-15%,3-4 years,Women 30%; leadership 18%,"Product driven, balanced, outcome focused",Medium-High,Medium-High,Regular,65%,High,Medium,Limited,High,Limited travel sustainability initiatives,Structured,"1,200 crore INR+",Low positive,Commissions 70%; Ads and services 30%,2-3 billion USD,15-20%,Profitable,Flipkart Group,No recent external rounds,2 billion USD+,Medium,High,1–4,8-10%,55,Controlled under 10% of revenue,24+,Below 1.5,Hybrid,8-9 hours,Low,Rare,Medium-High,Central,Excellent,Available late hours,30-60 minutes,Commercial business district,Very safe,Corporate safety standards,High,Regular drills,Ayyappan R,https://www.linkedin.com/in/ayyappanr,Leadership team under Flipkart Group,Flipkart network and alumni,Medium,NA,NA,support@cleartrip.com,NA,Flipkart appointed board,Medium,High,Strong,High,Medium,Medium,Medium,Modern product stack,High,Medium,High,Balanced,High,High,Mature platform,Strong,Mass consumer,Strong,High,Strong,High,Medium,Google Cloud; AWS; Airline APIs; IRCTC,Proprietary booking and pricing systems,8-10% of revenue,Medium-High,Java; React; Kubernetes; GCP; AWS,Strong,"Airline, hotel, fintech partners",High
97,PhysicsWallah Private Limited,PhysicsWallah; PW,https://upload.wikimedia.org/wikipedia/commons/4/4a/PhysicsWallah_Logo.png,Private Enterprise,2020,"PhysicsWallah is India’s leading affordable edtech platform providing online and offline education for competitive exams, school curriculum, and skill development, serving millions of students across India.",Private,"Noida, Uttar Pradesh, India",India,30,"Noida, India; Delhi, India; Bangalore, India; Hyderabad, India; Mumbai, India; Pune, India; Chennai, India; Kolkata, India; Jaipur, India; Patna, India",5000,Democratize education for every student in India,Provide quality education at affordable prices using technology,Accessibility; Affordability; Excellence; Student-first; Integrity,Started as a YouTube channel; One of India’s fastest unicorns,2024: Expanded offline centers to 300+ cities; 2025: IPO preparation discussions,https://www.pw.live,https://www.linkedin.com/company/physicswallah,@physicswallah,https://www.facebook.com/physicswallah,https://www.instagram.com/physicswallah,support@pw.live,91-120-4610500,UGC compliance; IT Act; GST,NA,Scholarship programs; education access initiatives,Content creators; publishing vendors; cloud providers,Minimal,Education policy changes; economic slowdown,120000 metric tons CO2e,Fair faculty contracts; ethical vendor sourcing,https://www.youtube.com/@PhysicsWallah,Student success stories and government exam ranks,Clean UI; student-focused; fast mobile experience,8.8/10,Global 700; India 45,12000000,4.0/5,4.1/5,4.6 out/5,Forbes 30 Under 30 India; Startup of the Year Awards; Google Play Best App,Very Positive,Startup India Summit; EdTech conferences; YouTube Creator Events,Affordable education; Quality exam preparation; Digital learning access; Tier 2 and Tier 3 student reach,EdTech; Online Education; Test Preparation; K-12 Education,Online courses; Offline coaching centers; PW App; Test series; Study materials,School students; NEET aspirants; JEE aspirants; UPSC aspirants; Government exam candidates,High-quality education at ultra-affordable pricing; expert faculty; mass accessibility,Ultra-low pricing; star faculty; massive student base; vernacular education,Brand trust; Affordable pricing; Scale; Hybrid online-offline model,High operational costs; faculty dependency; offline expansion complexity,Maintaining teaching quality at scale; profitability; operational efficiency,Unacademy; BYJU’S; Vedantu; Allen Digital; Aakash,30% (Online exam preparation India),Digital-first self-service,No,IPO planned,More affordable than BYJU’S; higher reach than Vedantu,40000000000,Offline expansion; AI personalization; profitability,NASSCOM; IAMAI; FICCI,Millions of government exam selections,Mobile-first; freemium model; influencer marketing,AI tutors; adaptive learning systems,AI learning companion; voice-based learning,1.00E+12,3.50E+11,1.20E+11,Flexible PTO; parental leave,Group insurance; wellness programs,85% fixed; 15% variable,Medium,ESOP grants,Full family coverage,Housing; travel support,Meals; wellness programs,Faculty; Content Developers; Software Engineers; Data Analysts; Academic Counselors,15%,2.8 years,40% women workforce,Fast-paced; mission-driven; student-focused,High,Medium High,Continuous,Strong focus,High,Medium,Limited,Very high,Education scholarships; rural education,Transparent; employee-first,19000000000 INR,1200000000 INR,Online courses 55%; Offline centers 35%; Books and test series 10%,280000000000 INR,45%,Profitable,WestBridge Capital; GSV Ventures; Lightspeed,NA,30000000000 INR,NA,NA,NA,18%,68,NA,NA,NA,Hybrid,9 to 10 hours per day,Moderate,Occasional,Hybrid,Central business hubs,Good,Corporate cabs; night transport,45 minutes,IT park,High,Employee safety guidelines,CCTV; biometric access; fire safety,Fire drills; medical support,Alakh Pandey,https://www.linkedin.com/in/alakh-pandey,Alakh Pandey ; Prateek Maheshwari,IIT alumni network; EdTech investor ecosystem; Startup founders,Medium,NA,Corporate Communications,press@pw.live,NA,Alakh Pandey; WestBridge nominees,300000000,Very good,Strong internal training,High-impact startup scale learning,Senior leadership mentoring,High,Merit-based,Modern edtech stack,High,Very high,Direct student outcome impact,Execution-heavy,Medium High,Product; tech; content; operations,Scale-up,Very high,Students nationwide,EdTech startups; BigTech; MNCs,Very high,Top Indian EdTech brand,Strong startup ecosystem,Limited,AWS; Google Cloud; Razorpay; Zoom,Course content IP; LMS platform,1200000000,Medium to High,Python; Java; AWS; React; MySQL; Kubernetes,ISO27001; SOC2,Google; AWS; State education boards,Industry Leader
100,Virtusa Corporation,Virtusa,https://upload.wikimedia.org/wikipedia/commons/7/7b/Virtusa_logo.svg,Private Enterprise,1996,"Virtusa is a global IT services and digital engineering company delivering consulting, technology, and outsourcing services focused on digital transformation, cloud, data, and enterprise modernization.",Private,"Southborough, Massachusetts, United States",United States; India; Sri Lanka; United Kingdom; Germany; Australia; United Arab Emirates,45,"Hyderabad,India; Chennai,India; Bangalore,India; Pune,India; Mumbai,India; Colombo,Sri Lanka; London,United Kingdom; Frankfurt,Germany",35000,To engineer businesses for the digital world,Enable enterprises to innovate and transform using digital technologies,Integrity; Innovation; Excellence; Collaboration; Customer centricity,Acquired Polaris Consulting; strong Sri Lanka delivery base,2024: Expanded generative AI services; 2025: Cloud-led BFSI growth focus,https://www.virtusa.com,https://www.linkedin.com/company/virtusa,@VirtusaCorp,https://www.facebook.com/VirtusaCorp,https://www.instagram.com/virtusacorp,info@virtusa.com,5273,ISO27001; SOC2; GDPR; HIPAA,NA,Sustainability initiatives; DEI programs; carbon reduction,Cloud providers; enterprise software vendors,Cross-border regulations; visa policies,IT spending slowdown; global recession,160000 metric tons CO2e,Responsible sourcing; vendor audits,https://www.youtube.com/@VirtusaCorp,BFSI digital transformation success stories,Professional; enterprise-focused; clear service positioning,8.7 out of 10,Global 3500; India 420,700000,3.7 out of 5,3.8 out of 5,4.1 out of 5,Everest Group PEAK Matrix Leader; IAOP Global Outsourcing 100; Great Place to Work,Positive,AWS re:Invent; Gartner IT Symposium; NASSCOM TechSummit,Legacy modernization; Digital transformation; Cloud migration; Data enablement,BFSI; Healthcare; Telecom; Media; Travel; Technology,Digital engineering; Cloud services; Data analytics; Enterprise modernization; Managed services,Global banks; Insurance firms; Telecom operators; Healthcare enterprises; Fortune 500 companies,Domain expertise; agile delivery; cost-effective global execution; deep client partnerships,Engineering-led delivery; BFSI specialization; automation-driven execution,Strong domain expertise; scalable delivery; enterprise relationships,High attrition; margin pressure; limited product IP,Talent retention; margin improvement; automation scale,TCS; Infosys; Wipro; Cognizant; Accenture; Capgemini,3%,Enterprise field sales,No,Acquired by Baring Private Equity Asia,Strong BFSI focus; smaller scale than TCS,3000000000 USD revenue by 2027,AI services; cloud modernization; BFSI growth,NASSCOM; IAOP; CII,Global bank modernization; telecom OSS transformation,Enterprise consulting-led sales,Generative AI platforms; automation tools,AI accelerators; digital engineering tools,1500000000000 USD,420000000000 USD,12000000000 USD,Flexible PTO; parental leave,Group insurance; wellness programs,80% fixed; 20% variable,Medium,Performance bonuses; stock incentives,Full family coverage,Housing; travel,Meals; wellness programs; transport,Software Engineers; Cloud Architects; Data Engineers; Business Analysts; QA Engineers,18%,3.2 years,35% women workforce,Client-focused; fast-paced; engineering-driven,Medium High,Medium,Structured,Active programs,High,Medium,Limited,Very high,Education initiatives; green programs,Transparent; employee-focused,2100000000 USD,120000000 USD,BFSI 45%; Telecom 20%; Healthcare 15%; Others 20%,2000000000 USD,14%,Profitable,Baring Private Equity Asia,NA,400000000 USD,NA,NA,NA,10%,64,NA,NA,NA,Hybrid,9 to 10 hours per day,Moderate,Occasional,Hybrid,IT parks and business hubs,Good,Corporate cab; night transport,60 minutes,IT park,High,Employee safety policies; night transport,CCTV; access control; fire systems,Fire drills; medical emergency support,Nitesh Banga,https://www.linkedin.com/in/niteshbanga,Nitesh Banga – CEO; Raj Rajgopal – COO,IIT alumni network; BFSI executive network,Medium,NA,Corporate Communications,media@virtusa.com,NA,Nitesh Banga; Baring PE nominees,60000000 USD,Good,Strong technical learning programs,Enterprise digital projects,Senior mentoring,High,Merit-based,Modern enterprise tools,High,Medium High,Direct client impact,Balanced,High,Cloud; data; engineering; consulting,Mature enterprise,High,Fortune 500 enterprises,MNC IT firms; startups; consulting,Very high,Strong IT services brand,Strong alumni network,High,AWS; Microsoft Azure; Google Cloud; Salesforce; SAP,Automation frameworks; digital accelerators,80000000 USD,High,Java; Python; AWS; Azure; Kubernetes; SAP,SOC2; ISO27001; Zero Trust,AWS; Microsoft; Google; Salesforce; SAP,Industry Leader
101,upGrad Education Private Limited,upGrad,https://upload.wikimedia.org/wikipedia/commons/4/41/UpGrad_logo.png,Private Enterprise,2015,"upGrad is a leading global online higher education and professional upskilling platform offering degree programs, certification courses, and enterprise learning solutions in collaboration with top universities and institutions.",Private,"Mumbai, Maharashtra, India",India; United States; United Arab Emirates , 6+ ,"Mumbai, India; Bangalore, India; Patna, India; Coimbatore, India; Washington, United States; Dubai, United Arab Emirates",5500,Power career success for every learner,Make professionals globally employable through quality education,Outcome-driven; Integrity; Learner-first; Excellence; Inclusion,India’s first online higher education unicorn; operates in over 50 countries,2024: Expanded Middle East presence; 2025: Strengthened global university partnerships,https://www.upgrad.com,https://www.linkedin.com/company/upgrad,@upGrad_edu,https://www.facebook.com/upgrad.education,https://www.instagram.com/upgrad_edu,support@upgrad.com,2261773909,UGC; AICTE; IT Act; GST,NA,Education inclusion programs; digital skilling initiatives,Cloud vendors; content partners; universities,Data localization rules; education policy changes,Hiring slowdowns; education budget reductions,130000 metric tons CO2e,Fair instructor policies; ethical vendor sourcing,https://www.youtube.com/@upGrad,Learner career transition stories,"Professional, learner-centric, smooth navigation",9.0 out of 10,Global 600; India 70,5000000,3.8 out of 5,4.0 out of 5,4.2 out of 5,Forbes India Leadership Award; ET Startup Award; LinkedIn Top Startups,Positive,Global EdTech Summit; World Economic Forum panels; Startup India,Skill gap in workforce; Career transitions; Affordable higher education; Industry-aligned learning,EdTech; Online Higher Education; Corporate Learning; Professional Upskilling,Online degree programs; Professional certificates; Bootcamps; Corporate training,Working professionals; College students; Enterprises; Government organizations,Industry-relevant education; global university partnerships; flexible learning; career outcomes,University-backed online degrees; career-focused curriculum; global presence,Strong partnerships; global footprint; career services; high completion rates,High customer acquisition cost; pricing sensitivity; operational complexity,Profitability; competition; student retention; scalability,Coursera; Simplilearn; Great Learning; Udacity; Emeritus,25% (Indian online higher education),Digital-first PLG plus enterprise sales,No,IPO planned,Better university tie-ups than Simplilearn; broader catalog than Udacity,15000000000 INR revenue by 2027,Global expansion; enterprise learning; AI-powered personalization,NASSCOM; IAMAI; CII,Career transitions to MNC roles; enterprise skilling success,Content marketing; performance ads; partnerships,AI tutors; adaptive learning pathways,Career mapping engine; AI-based learning coach,2500000000000 INR,850000000000 INR,220000000000 INR,Flexible PTO; parental leave,Group insurance; wellness programs,80% fixed; 20% variable,Medium,ESOP grants,Full family coverage,Housing; travel,Meals; wellness programs; transport,Software Engineers; Academic Counselors; Product Managers; Data Scientists; Sales Executives,17%,2.9 years,42% women workforce,Fast-paced; learner-focused; execution-driven,High,Medium High,Continuous,Strong DEI initiatives,High,Medium,Limited,Very high,Education scholarships; digital inclusion,Transparent; employee-first,7200000000 INR,650000000 INR,Online degrees 55%; Professional certifications 35%; Enterprise training 10%,180000000000 INR,30%,Profitable,Temasek; IFC; IIFL; Sequoia; Kaizen,NA,24000000000 INR,NA,NA,NA,14%,66,NA,NA,NA,Hybrid,9 to 10 hours per day,Moderate,Occasional,Hybrid,Central business hubs,Good,Corporate cabs; late-night transport,60 minutes,IT park,High,Employee safety protocols,Access control; CCTV; fire systems,Fire drills; medical emergency support,Ronnie Screwvala,https://www.linkedin.com/in/ronniescrewvala,Ronnie Screwvala – Co-founder & Chairperson; Mayank Kumar – Co-founder & CEO,IIT alumni network; Media and entertainment industry network; VC ecosystem,Medium,NA,Corporate Communications,press@upgrad.com,NA,Ronnie Screwvala; Mayank Kumar; Temasek nominees,350000000 INR,Very good,Strong continuous learning programs,High-impact EdTech projects,Senior leadership mentoring,High,Merit-based,Modern edtech stack,High,High,Direct learner success impact,Balanced,High,Product; tech; academics; marketing,Scale-up,Very high,Working professionals; enterprises,EdTech unicorns; BigTech; MNCs,Very high,Leading Indian EdTech brand,Strong startup and education ecosystem,High,AWS; Google Cloud; Zoom; Salesforce; Razorpay,Learning platform IP; curriculum frameworks,900000000 INR,High,Java; Python; AWS; React; MySQL; Kubernetes,ISO27001; SOC2,Harvard Online; IIT Madras; Liverpool John Moores University; Microsoft,Industry Leader
104,Paytm Money,Paytm Money,https://www.paytmmoney.com/static/media/logo.7c3e0b1f.svg,FinTech / Digital Investment Platform,2017,"Paytm Money is a digital investment platform offering mutual funds, stocks, ETFs, IPOs, NPS, and pension products for retail investors in India.",Private (Subsidiary of One97 Communications Ltd.),"Bangalore, Karnataka, India",India,NA,"Bangalore,India;Noida,India",300–500,To democratize wealth creation for every Indian,"Make investing simple, transparent, and accessible",Customer-first; Transparency; Simplicity; Trust,Among early platforms to popularize direct mutual fund investing in India,Expansion of stock broking and derivatives offerings (2023–2024),https://www.paytmmoney.com,https://www.linkedin.com/company/paytm-money/,https://twitter.com/paytmmoney,https://www.facebook.com/paytmmoney,https://www.instagram.com/paytmmoney/,care@paytmmoney.com,NA,SEBI-registered broker and mutual fund distributor,NA,NA,NA,Low,Market volatility; Regulatory changes,NA,NA,Available on Paytm Money website & YouTube,NA,High,NA,NA,50000,3.5/5,NA,NA,NA,Generally Positive,FinTech and investment conferences in India,Complex investing processes; High commissions; Lack of fee transparency; Low financial literacy,Financial Services; WealthTech; Retail Investments,Direct Mutual Funds; Stock Trading (Equity & Derivatives); ETFs; IPOs; NPS; Pension Products,Retail investors; First-time investors; Salaried professionals; Millennials,"Commission-free, easy-to-use investment platform integrated with Paytm ecosystem",Zero-commission direct mutual funds; Paytm ecosystem integration; Beginner-friendly UI,Strong Paytm brand; Large Paytm user base; Low-cost model,Limited advanced trading tools; Less attractive for professional traders,Intense discount broking competition; User retention in volatile markets,Zerodha; Groww; Upstox; Angel One,NA,B2C digital self-serve,Low,NA,Competitive but behind Zerodha/Groww in active traders,Growth aligned with retail investing adoption,User growth; Product expansion; Engagement,NA,NA,App-led growth; Paytm cross-promotion,Expanded derivatives; Advisory features,Enhanced trading tools; Analytics,Indian retail investors,Digital investment users,NA,NA,NA,NA,NA,NA,NA,NA,NA,Moderate,NA,NA,NA,"Fast-paced, startup-like",NA,NA,NA,NA,High,NA,NA,High,NA,NA,NA (included in Paytm group filings),NA,Brokerage fees; Platform services,NA (subsidiary of Paytm),NA,"$10,000,000",One97 Communications Ltd.,NA,NA,NA,NA,NA,NA,NA,NA,NA,NA,Hybrid,NA,NA,NA,Hybrid,Central,Good,NA,1–1.5 hours (Bangalore),Commercial IT zone,High,NA,NA,NA,Varun Sridhar,https://www.linkedin.com/in/varunsridhar/,Standard complete data for key_leaders,Via Paytm corporate partnerships,Low–Medium,NA,NA,NA,NA,Standard complete data for board_members,NA,NA,NA,NA,NA,NA,NA,Adequate,NA,NA,Moderate–High,Execution-focused,Moderate,NA,Growth-stage,Strong in India,Retail-focused,FinTech; Product; Analytics roles,High,Moderate,Strong Paytm ecosystem,Low,NA,NA,NA,"Moderate (recommendations, fraud detection)",NA,Standard fintech-grade security,Paytm ecosystem; AMCs; Stock exchanges,Moderate–High
105,Hexagon Capability Center India,HCC,https://www.example.com/hexagoncapabilitycenterindia,Engineering Software and Digital Solutions GCC,2019,Hexagon Capability Center is the global capability center of Hexagon Group providing engineering software development digital solutions analytics AI and enterprise services to support Hexagon businesses worldwide,Private,Hyderabad Telangana India,India; Sweden; United States; Germany ,1,"Hyderabad, India",3500 employees,To be a strategic global innovation hub for Hexagon,To accelerate Hexagon product innovation and digital transformation through global talent,Innovation integrity collaboration customer focus excellence,One of Hexagon’s fastest growing global capability centers,Expansion of AI and digital reality engineering teams 2024,https://hexagon.com,https://www.linkedin.com/company/hexagon-ab,https://x.com/HexagonAB,https://www.facebook.com/HexagonAB,https://www.instagram.com/hexagon_ab,NA,NA,ISO compliant internal Hexagon standards,NA,Hexagon Group ESG aligned,Engineering talent cloud infrastructure,India regional regulatory exposure,Global industrial slowdown,Hexagon group sustainability aligned,Hexagon supplier code of conduct,Available on Hexagon corporate channels,NA,High enterprise grade,4.3 out of 5,Top 20000 globally,50000,4.1 out of 5,4.2 out of 5,4.3 out of 5,NA,70% positive,Industrial digitalization engineering conferences,Engineering software scalability digitalization of industrial workflows automation analytics,Manufacturing Infrastructure Mining Geospatial Energy Automotive Aerospace,Engineering software development cloud platforms AI ML analytics quality assurance product support,Internal Hexagon business units and enterprise industrial clients,High quality engineering talent delivering scalable digital and industrial software solutions,Deep integration with Hexagon product teams strong engineering domain expertise,Product centric work exposure global engineering standards stable long term roadmap,Limited external client exposure GCC dependent revenue,Talent retention niche engineering skills scaling leadership depth,Siemens Global Capability Center Bosch Global Software Technologies GE Digital,NA,Internal chargeback model,Single parent company dependency 100%,NA,Comparable to Siemens GCC,Continued double digit growth,AI driven industrial software digital reality platforms,NA,Internal product platform modernization,Internal product enablement,Digital twins AI automation industrial analytics,Smart manufacturing geospatial intelligence tools,NA,NA,NA,18–24 days per year,Insurance wellness programs,80% fixed 20% variable,Moderate,NA,Included,Limited,Moderate,8–10% workforce growth per year,12% per year,3.8 years,Women workforce 28%,Product engineering focused,Above average,High,Regular performance check ins,Growing structured initiatives,High,Low to medium,NA,High,Group driven sustainability initiatives,Stable long term investment approach,NA,NA,Internal services 100%,NA,12% per year,Cost center,Hexagon AB,NA,NA,NA,NA,NA,NA,NA,NA,NA,NA,Hybrid,8–9 hours per day,Low,Rare,Hybrid,Central IT corridor,Moderate,Available for late shifts,45–60 minutes,IT SEZ,High,Strong corporate policies,ISO compliant,High,Paolo Guglielmini,NA,India GCC Director Product Engineering Heads,LinkedIn Hexagon referrals internal mobility,Low,NA,NA,NA,NA,Standard complete data for board_members,NA,High,Strong engineering learning culture,Global product exposure,Available,High,Moderate,Excellent,High,High,High product impact,Balanced,High,High,Growing GCC,High parent brand value,Internal global business units,Strong product engineering exits,High,Moderate,Strong internal network,High,Microsoft AWS Azure Google Cloud NVIDIA,Engineering patents software modules internal IP,NA,Advanced product embedded AI,C++ Python Java Cloud Native AI ML CAD CAM tools,High Hexagon global security standards,Academic institutions technology vendors startups,7.5 out of 10
